c_id,subject,type,text,question_1,initial_question_1,question_2,initial_question_2,question_3,initial_question_3,p.instruction_explicitness_of_instruction,p.mathematical_requirement_level,p.taxanomy_level,question_type,p.variation,answers,typed_pipeline_used,refinement_applied,format_preserved,expert_average_ratings,p.root_text_reference_explanatory_text,p.root_text_obstacle_passive,p.root_text_obstacle_negation,p.root_text_obstacle_complex_np,p.root_text_contains_irrelevant_information,p.instruction_obstacle_passive,p.instruction_obstacle_complex_np,dspy_consensus_used,dspy_modular_prompts,dspy_expert_count,dspy_all_approved,p.item_1_obstacle_passive,p.item_1_obstacle_negation,p.item_1_obstacle_complex_np,p.item_2_obstacle_passive,p.item_2_obstacle_negation,p.item_2_obstacle_complex_np,p.item_3_obstacle_passive,p.item_3_obstacle_negation,p.item_3_obstacle_complex_np,p.item_4_obstacle_passive,p.item_4_obstacle_negation,p.item_4_obstacle_complex_np,p.item_5_obstacle_passive,p.item_5_obstacle_negation,p.item_5_obstacle_complex_np,p.item_6_obstacle_passive,p.item_6_obstacle_negation,p.item_6_obstacle_complex_np,p.item_7_obstacle_passive,p.item_7_obstacle_negation,p.item_7_obstacle_complex_np,p.item_8_obstacle_passive,p.item_8_obstacle_negation,p.item_8_obstacle_complex_np
188-sys-10,stammaufgabe,single-choice,"Anbieter und Nachfrager auf Märkten Märkte sind Treffpunkte von Angebot und Nachfrage. Bei uns werden die meisten Güter über Märkte verteilt. Doch was genau ist so ein Markt? Die Nachfrage ist die Menge an Gütern, die Nachfrager und Nachfragerinnen auf Märkten kaufen wollen. Erinnerst du dich an das Konzertkarten-Beispiel? Hier sind die Fans die Nachfragerinnen und Nachfrager, denn sie wollen eine der Konzertkarten kaufen. Das Ziel der Nachfragerinnen und Nachfrager ist es, die Güter, die sie zur Befriedigung ihrer Bedürfnisse benötigen, zu möglichst niedrigen Preisen einzukaufen. Alltagssprache vs. Fachsprache: In der Alltagssprache sprechen wir auch von einer Nachfrage, wenn man etwas nicht verstanden hat. In der Fachsprache der Wirtschaft ist die Nachfrage die Menge an Gütern, die Käuferinnen und Käufer auf Märkten erwerben wollen. Das Angebot ist die Summe aller angebotenen Güter auf einem Markt. In dem Konzertkarten-Beispiel sind die Tickets, die die zum Verkauf stehen, das Angebot. In diesem Beispiel ist also der Konzertveranstalter der Anbieter. Anbieter wollen ihre Sachgüter oder Dienstleistungen auf Märkten verkaufen oder tauschen. Dabei ist ihr Ziel einen möglichst hohen Preis zu erzielen.  ","Was genau ist die Nachfrage in der Wirtschaft? <option>Die Menge an Gütern, die Anbieter auf Märkten verkaufen wollen<option>Die Summe aller angebotenen Güter auf einem Markt<option>Die Menge an Gütern, die Käuferinnen und Käufer auf Märkten erwerben wollen<option>Das Angebot","Was genau ist die Nachfrage in der Wirtschaft?

A) Die Menge an Gütern, die Anbieter auf Märkten verkaufen wollen
B) Die Summe aller angebotenen Güter auf einem Markt
C) Die Menge an Gütern, die Käuferinnen und Käufer auf Märkten erwerben wollen
D) Das Angebot",Was ist das Ziel der Anbieter? <option>Einen möglichst niedrigen Preis zu erzielen<option>Ein bestimmtes Produkt zu verkaufen<option>Die Nachfrage zu maximieren<option>Einen möglichst hohen Preis zu erzielen,"Was ist das Ziel der Anbieter?

A) Einen möglichst niedrigen Preis zu erzielen
B) Ein bestimmtes Produkt zu verkaufen
C) Die Nachfrage zu maximieren
D) Einen möglichst hohen Preis zu erzielen","Was ist ein Markt? <option>Ein Ort, an dem Güter gekauft und verkauft werden<option>Ein Ort, an dem Anbieter ihre Sachgüter oder Dienstleistungen verkaufen wollen<option>Ein Ort, an dem die Nachfrage maximiert wird<option>Ein Ort, an dem der Preis niedrig ist","Was ist ein Markt?

A) Ein Ort, an dem Güter gekauft und verkauft werden
B) Ein Ort, an dem Anbieter ihre Sachgüter oder Dienstleistungen verkaufen wollen
C) Ein Ort, an dem die Nachfrage maximiert wird
D) Ein Ort, an dem der Preis niedrig ist",Implizit,0 (Kein Bezug),Stufe 2 (Anwendung/Transfer),single-choice,stammaufgabe,"Die Menge an Gütern, die Anbieter auf Märkten verkaufen wollen, Die Summe aller angebotenen Güter auf einem Markt, Die Menge an Gütern, die Käuferinnen und Käufer auf Märkten erwerben wollen, Das Angebot, Einen möglichst niedrigen Preis zu erzielen, Ein bestimmtes Produkt zu verkaufen, Die Nachfrage zu maximieren, Einen möglichst hohen Preis zu erzielen, Ein Ort, an dem Güter gekauft und verkauft werden, Ein Ort, an dem Anbieter ihre Sachgüter oder Dienstleistungen verkaufen wollen, Ein Ort, an dem die Nachfrage maximiert wird, Ein Ort, an dem der Preis niedrig ist",True,"[False, False, False]","[True, True, True]","[3.2, 3.2, 3.0]",Nicht vorhanden,Enthalten,Nicht Enthalten,Nicht Enthalten,Nicht Enthalten,Enthalten,Enthalten,True,True,5,True,Nicht Enthalten,Enthalten,Nicht Enthalten,Enthalten,Enthalten,Nicht Enthalten,Nicht Enthalten,Nicht Enthalten,Enthalten,Enthalten,Nicht Enthalten,Enthalten,Nicht Enthalten,Enthalten,Enthalten,Enthalten,Enthalten,Enthalten,Nicht Enthalten,Nicht Enthalten,Nicht Enthalten,Enthalten,Nicht Enthalten,Nicht Enthalten
