c_id,subject,type,text,question_1,initial_question_1,question_2,initial_question_2,question_3,initial_question_3,p.instruction_explicitness_of_instruction,p.mathematical_requirement_level,p.taxanomy_level,question_type,p.variation,answers,typed_pipeline_used,refinement_applied,format_preserved,expert_average_ratings,p.root_text_reference_explanatory_text,p.root_text_obstacle_passive,p.root_text_obstacle_negation,p.root_text_obstacle_complex_np,p.root_text_contains_irrelevant_information,p.instruction_obstacle_passive,p.instruction_obstacle_complex_np,dspy_consensus_used,dspy_modular_prompts,dspy_expert_count,dspy_all_approved,p.item_1_obstacle_passive,p.item_1_obstacle_negation,p.item_1_obstacle_complex_np,p.item_2_obstacle_passive,p.item_2_obstacle_negation,p.item_2_obstacle_complex_np,p.item_3_obstacle_passive,p.item_3_obstacle_negation,p.item_3_obstacle_complex_np,p.item_4_obstacle_passive,p.item_4_obstacle_negation,p.item_4_obstacle_complex_np,p.item_5_obstacle_passive,p.item_5_obstacle_negation,p.item_5_obstacle_complex_np,p.item_6_obstacle_passive,p.item_6_obstacle_negation,p.item_6_obstacle_complex_np,p.item_7_obstacle_passive,p.item_7_obstacle_negation,p.item_7_obstacle_complex_np,p.item_8_obstacle_passive,p.item_8_obstacle_negation,p.item_8_obstacle_complex_np
187-sys-5,schwer,multiple-choice,"Knappheit Einige Güter kann man haben, ohne dafür bezahlen zu müssen. Denk z.B. an die Luft zum Atmen: Da diese Güter niemandem gehören, können sie unbegrenzt und ohne Bezahlung genutzt werden. Solche Güter nennt man freie Güter. Je knapper ein Gut ist, desto höher ist i.d.R. sein Preis. Freie Güter zeichnen sich dadurch aus, dass sie kostenlos sind. Leider trifft dies nur auf sehr wenige Güter zu. Von den meisten Gütern gibt es nicht so viel, dass jeder Mensch einfach so viel davon haben kann, wie er will. Solche Güter nennt man knappe Güter. Knappheit liegt also dann vor, wenn ein Gut nur in einer geringeren Menge als gewünscht vorhanden ist. Es gibt dabei jedoch zwei Arten von Knappheit, bei denen genauer betrachtet wird, warum einige Menschen nicht so viel von einem Gut haben können, wie sie wollen: Absolute Knappheit liegt dann vor, wenn ein Gut zu einer bestimmten Zeit und an einem bestimmten Ort nicht oder nur in sehr begrenzter Menge vorhanden ist, z.B. Wasser in der Wüste. Für Relative Knappheit ist die Menge, in der ein Gut vorhanden ist, zweitrangig. Relative Knappheit kann auch vorliegen, wenn es sehr viel von einem Gut gibt. Entscheidend ist allein, dass die Mittel der Menschen nicht ausreichen und sie somit nicht so viel von einem Gut haben können, wie sie wollen. ","Was sind Güter, die niemandem gehören und somit unbegrenzt genutzt werden können? <option>Knappheit<option>Relative Knappheit<option>Zusätzliche Option 3<option>Zusätzliche Option 4<option>Zusätzliche Option 5<option>Zusätzliche Option 6","Was sind Güter, die niemandem gehören und somit unbegrenzt genutzt werden können?

A) Knappe Güter
B) Freie Güter
C) Knappheit
D) Relative Knappheit",Warum liegt Absolute Knappheit vor? <option>Weil die Mittel der Menschen nicht ausreichen.<option>Zusätzliche Option 2<option>Zusätzliche Option 3<option>Zusätzliche Option 4<option>Zusätzliche Option 5<option>Zusätzliche Option 6,"Warum liegt Absolute Knappheit vor?

A) Weil ein Gut zu einer bestimmten Zeit und an einem bestimmten Ort nicht oder nur in sehr begrenzter Menge vorhanden ist.
B) Weil die Menge, in der ein Gut vorhanden ist, zweitrangig ist.
C) Weil die Mittel der Menschen nicht ausreichen.
D) Weil es sehr viel von einem Gut gibt.","Was ist entscheidend für Relative Knappheit?

A) Die Menge, in der ein Gut vorhanden ist
B) Die Zeit und der Ort, an dem ein Gut verfügbar ist
C) Die Mittel der Menschen
D) Der Preis eines Gutes <option>[option] C) Die Mittel der Menschen [/option]
[option] A) Die Menge<option>in der ein Gut vorhanden ist [/option]
[option] B) Die Zeit und der Ort<option>an dem ein Gut verfügbar ist [/option]
[option] D) Der Preis eines Gutes [/option]<option>Zusätzliche Option 4<option>Zusätzliche Option 5<option>Zusätzliche Option 6","Was ist entscheidend für Relative Knappheit?

A) Die Menge, in der ein Gut vorhanden ist
B) Die Zeit und der Ort, an dem ein Gut verfügbar ist
C) Die Mittel der Menschen
D) Der Preis eines Gutes",Explizit,1 (Mit Bezug),Stufe 1 (Wissen/Reproduktion),multiple-choice,schwer,"Knappheit, Relative Knappheit, Zusätzliche Option 3, Zusätzliche Option 4, Zusätzliche Option 5, Zusätzliche Option 6, Weil die Mittel der Menschen nicht ausreichen., Zusätzliche Option 2, Zusätzliche Option 3, Zusätzliche Option 4, Zusätzliche Option 5, Zusätzliche Option 6, [option] C) Die Mittel der Menschen [/option]
[option] A) Die Menge, in der ein Gut vorhanden ist [/option]
[option] B) Die Zeit und der Ort, an dem ein Gut verfügbar ist [/option]
[option] D) Der Preis eines Gutes [/option], Zusätzliche Option 4, Zusätzliche Option 5, Zusätzliche Option 6",True,"[True, True, True]","[True, True, True]","[2.8, 2.6, 3.0]",Explizit,Nicht Enthalten,Nicht Enthalten,Enthalten,Enthalten,Nicht Enthalten,Nicht Enthalten,True,True,5,True,Enthalten,Nicht Enthalten,Enthalten,Nicht Enthalten,Enthalten,Enthalten,Enthalten,Enthalten,Enthalten,Nicht Enthalten,Nicht Enthalten,Nicht Enthalten,Enthalten,Nicht Enthalten,Nicht Enthalten,Nicht Enthalten,Enthalten,Nicht Enthalten,Enthalten,Enthalten,Nicht Enthalten,Nicht Enthalten,Nicht Enthalten,Enthalten
