c_id,subject,type,text,question_1,initial_question_1,question_2,initial_question_2,question_3,initial_question_3,p.instruction_explicitness_of_instruction,p.mathematical_requirement_level,p.taxanomy_level,question_type,p.variation,answers,typed_pipeline_used,refinement_applied,format_preserved,expert_average_ratings,p.root_text_reference_explanatory_text,p.root_text_obstacle_passive,p.root_text_obstacle_negation,p.root_text_obstacle_complex_np,p.root_text_contains_irrelevant_information,p.instruction_obstacle_passive,p.instruction_obstacle_complex_np,dspy_consensus_used,dspy_modular_prompts,dspy_expert_count,dspy_all_approved,p.item_1_obstacle_passive,p.item_1_obstacle_negation,p.item_1_obstacle_complex_np,p.item_2_obstacle_passive,p.item_2_obstacle_negation,p.item_2_obstacle_complex_np,p.item_3_obstacle_passive,p.item_3_obstacle_negation,p.item_3_obstacle_complex_np,p.item_4_obstacle_passive,p.item_4_obstacle_negation,p.item_4_obstacle_complex_np,p.item_5_obstacle_passive,p.item_5_obstacle_negation,p.item_5_obstacle_complex_np,p.item_6_obstacle_passive,p.item_6_obstacle_negation,p.item_6_obstacle_complex_np,p.item_7_obstacle_passive,p.item_7_obstacle_negation,p.item_7_obstacle_complex_np,p.item_8_obstacle_passive,p.item_8_obstacle_negation,p.item_8_obstacle_complex_np
181-sys-1,stammaufgabe,multiple-choice,"Bedürfnisse sind Wünsche Menschen haben Wünsche. Sie entstehen, wenn man das Gefühl hat, dass einem etwas fehlt. In der Wirtschaft bezeichnet man solche Wünsche allgemein auch als Bedürfnisse. Wenn es kalt ist, hat man das Bedürfnis sich zu wärmen. Wenn du dich einsam fühlst, hast du vielleicht ein Bedürfnis nach Zuneigung oder Freundschaft. Wenn dir langweilig ist, hast du zumeist das Bedürfnis, etwas zu unternehmen. <image>Du siehst: Bedürfnisse können ganz vielfältig sein! Und sie unterscheiden sich individuell je nach Person. Kinder haben z. B. häufig andere Bedürfnisse als Erwachsene. Sie wollen z. B. häufiger spielen. Erwachsene hingegen haben vielleicht eher den Wunsch, finanziell abgesichert zu sein. Aber auch die Bedürfnisse von Kindern untereinander unterscheiden sich. Manche Kinder spielen lieber draußen und andere verbringen die Zeit lieber drinnen zum Beispiel beim Lesen. In der Wirtschaft gehen wir davon aus, dass Bedürfnisse unbegrenzt sind. Jeder Mensch hat gleichzeitig sehr viele unterschiedliche Bedürfnisse. Wenn ein Bedürfnis erfüllt (man sagt: befriedigt) ist, widmet man sich direkt einem anderen. Beispiel: Stell dir vor, du kommst nach dem Sport nach Hause. Du willst duschen (du hast das Bedürfnis nach Sauberkeit), hast Hunger (Bedürfnis etwas zu essen), willst dich ausruhen (Bedürfnis nach Erholung). Später am Abend ist dir dann vielleicht langweilig und du möchtest dir einen Film anschauen (Bedürfnis nach Unterhaltung) … Du siehst: Man hat nicht nur sehr viele Bedürfnisse gleichzeitig, meist kommen auch immer wieder neue dazu! ","Was ist ein Bedürfnis? <option>Ein Wunsch, den man nicht erfüllen kann<option>Ein Wunsch, den man erfüllen muss<option>Ein Wunsch, der unbegrenzt ist<option>Ein Gefühl, dass einem etwas fehlt<option>Zusätzliche Option 5<option>Zusätzliche Option 6","Was ist ein Bedürfnis?

A) Ein Wunsch, den man nicht erfüllen kann
B) Ein Wunsch, den man erfüllen muss
C) Ein Wunsch, der unbegrenzt ist
D) Ein Gefühl, dass einem etwas fehlt","Warum entstehen Bedürfnisse? <option>Weil man das Gefühl hat, dass einem etwas zu viel gibt<option>Weil man das Gefühl hat, dass einem etwas fehlt<option>Weil man sich selbst überschätzt<option>Weil man andere überschätzt<option>Zusätzliche Option 5<option>Zusätzliche Option 6","Warum entstehen Bedürfnisse?

A) Weil man das Gefühl hat, dass einem etwas zu viel gibt
B) Weil man das Gefühl hat, dass einem etwas fehlt
C) Weil man sich selbst überschätzt
D) Weil man andere überschätzt","Wie verhalten sich Menschen, wenn ihre Bedürfnisse erfüllt sind? <option>Sie widmen sich sofort einem anderen Bedürfnis<option>Sie widmen sich immer wieder dem gleichen Bedürfnis<option>Sie geben auf alle ihre Bedürfnisse<option>Sie haben keine Bedürfnisse mehr<option>Zusätzliche Option 5<option>Zusätzliche Option 6","Wie verhalten sich Menschen, wenn ihre Bedürfnisse erfüllt sind?

A) Sie widmen sich sofort einem anderen Bedürfnis
B) Sie widmen sich immer wieder dem gleichen Bedürfnis
C) Sie geben auf alle ihre Bedürfnisse
D) Sie haben keine Bedürfnisse mehr",Explizit,0 (Kein Bezug),Stufe 1 (Wissen/Reproduktion),multiple-choice,stammaufgabe,"Ein Wunsch, den man nicht erfüllen kann, Ein Wunsch, den man erfüllen muss, Ein Wunsch, der unbegrenzt ist, Ein Gefühl, dass einem etwas fehlt, Zusätzliche Option 5, Zusätzliche Option 6, Weil man das Gefühl hat, dass einem etwas zu viel gibt, Weil man das Gefühl hat, dass einem etwas fehlt, Weil man sich selbst überschätzt, Weil man andere überschätzt, Zusätzliche Option 5, Zusätzliche Option 6, Sie widmen sich sofort einem anderen Bedürfnis, Sie widmen sich immer wieder dem gleichen Bedürfnis, Sie geben auf alle ihre Bedürfnisse, Sie haben keine Bedürfnisse mehr, Zusätzliche Option 5, Zusätzliche Option 6",True,"[False, True, False]","[True, True, True]","[2.8, 3.4, 3.0]",Nicht vorhanden,Nicht Enthalten,Nicht Enthalten,Nicht Enthalten,Enthalten,Nicht Enthalten,Nicht Enthalten,True,True,5,True,Enthalten,Nicht Enthalten,Nicht Enthalten,Nicht Enthalten,Enthalten,Nicht Enthalten,Enthalten,Enthalten,Nicht Enthalten,Nicht Enthalten,Nicht Enthalten,Enthalten,Enthalten,Nicht Enthalten,Enthalten,Nicht Enthalten,Enthalten,Enthalten,Enthalten,Enthalten,Enthalten,Nicht Enthalten,Nicht Enthalten,Nicht Enthalten
182-sys-2,schwer,single-choice,"Die Bedürfnispyramide nach Maslow Es gibt verschiedene Arten von Bedürfnissen. Der Psychologe Abraham Maslow entwickelte eine Pyramide, die Bedürfnisse verschiedenen Gruppen zuordnet und nach ihrer Dringlichkeit sortiert. Bedürfnisse auf unteren Stufen müssen in der Regel zunächst befriedigt werden, bevor man sich der Befriedigung weiter obenstehender Bedürfnisse widmet. <image><image>Stell dir vor, du bist auf einer einsamen Insel gestrandet. Um was kümmerst du dich zuerst? Klar, zunächst kümmerst du dich um das, was du zum Überleben brauchst: Essen, Trinken, einen Schlafplatz (Physiologische Grundbedürfnisse). Und dann? Vielleicht baust du dir einen Speer, um dich vor wilden Tieren zu schützen. Oder du baust dir eine wetterfeste Behausung (Sicherheitsbedürfnisse). Wenn alle dies erledigt ist, beginnst du womöglich etwas einsam zu werden – du wünschst dir Kontakt mit Menschen (soziale Bedürfnisse)… → So gelangt man von Bedürfnis zu Bedürfnis – und in der Pyramide immer weiter nach oben. ","Was sind die drei Grundbedürfnisse, die man als Erstes befriedigen muss, wenn man auf einer einsamen Insel gestrandet ist? <option>Sicherheitsbedürfnisse<option>Soziale Bedürfnisse<option>Physiologische Grundbedürfnisse<option>Option 4","Was sind die drei Grundbedürfnisse, die man als Erstes befriedigen muss, wenn man auf einer einsamen Insel gestrandet ist?

A) Sicherheitsbedürfnisse
B) Soziale Bedürfnisse
C) Physiologische Grundbedürfnisse",Welche Bedürfnisgruppe steht in der Pyramide von Maslow an zweiter Stelle nach den physiologischen Grundbedürfnissen? <option>Sicherheitsbedürfnisse<option>Soziale Bedürfnisse<option>Selbstverwirklichungsbedürfnisse<option>Option 4,"Welche Bedürfnisgruppe steht in der Pyramide von Maslow an zweiter Stelle nach den physiologischen Grundbedürfnissen?

A) Sicherheitsbedürfnisse
B) Soziale Bedürfnisse
C) Selbstverwirklichungsbedürfnisse","Welches ist das nächste, was du tun würdest, nachdem alle deine physiologischen Grundbedürfnisse befriedigt sind? <option>Ein wetterfestes Haus bauen<option>Einen Speer anfertigen, um dich vor wilden Tieren zu schützen<option>Kontakt mit Menschen aufnehmen<option>Option 4","Welches ist das nächste, was du tun würdest, nachdem alle deine physiologischen Grundbedürfnisse befriedigt sind?

A) Ein wetterfestes Haus bauen
B) Einen Speer anfertigen, um dich vor wilden Tieren zu schützen
C) Kontakt mit Menschen aufnehmen",Implizit,1 (Mit Bezug),Stufe 2 (Anwendung/Transfer),single-choice,schwer,"Sicherheitsbedürfnisse, Soziale Bedürfnisse, Physiologische Grundbedürfnisse, Option 4, Sicherheitsbedürfnisse, Soziale Bedürfnisse, Selbstverwirklichungsbedürfnisse, Option 4, Ein wetterfestes Haus bauen, Einen Speer anfertigen, um dich vor wilden Tieren zu schützen, Kontakt mit Menschen aufnehmen, Option 4",True,"[True, False, False]","[True, True, True]","[3.2, 3.2, 3.0]",Explizit,Enthalten,Nicht Enthalten,Nicht Enthalten,Nicht Enthalten,Enthalten,Enthalten,True,True,5,True,Nicht Enthalten,Enthalten,Nicht Enthalten,Enthalten,Enthalten,Nicht Enthalten,Nicht Enthalten,Nicht Enthalten,Enthalten,Enthalten,Nicht Enthalten,Enthalten,Nicht Enthalten,Enthalten,Enthalten,Enthalten,Enthalten,Enthalten,Nicht Enthalten,Nicht Enthalten,Nicht Enthalten,Enthalten,Nicht Enthalten,Nicht Enthalten
183-sys-3,leicht,true-false,"Aus Bedürfnis wird Bedarf Vorsicht! In der Alltagssprache unterscheidet man nicht immer genau zwischen Bedürfnis und Bedarf. In der Wirtschaft bedeuten die Begriffe aber, wie du gleich lernst, etwas Unterschiedliches. Du weißt jetzt, was Bedürfnisse sind. In der Wirtschaft unterscheidet man zwischen Bedürfnissen und Bedarf. Als Bedarf bezeichnet man die konkrete Bereitschaft, seine Mittel (bspw. Zeit oder Geld) für bestimmte Dingen oder Leistungen zur Befriedigung von Bedürfnissen zu verwenden. Kompliziert? Hier ein paar Beispiele: Wenn man hungrig ist, will man z. B. einen Apfel, um seinen Hunger zu befriedigen. Aus dem Bedürfnis, etwas zu essen, erwächst der konkrete Bedarf nach einem Apfel. Wenn dir langweilig ist, willst du z. B. ein neues Videospiel haben. Aus dem Bedürfnis nach Unterhaltung erwächst der konkrete Bedarf nach einem bestimmten Videospiel. Wenn man unglücklich mit seinem Haarschnitt ist, geht man zum Friseur. Aus dem Bedürfnis, sein Aussehen zu verbessern, erwächst der konkrete Bedarf nach einem neuen Haarschnitt vom Friseur. Man spricht nicht nur bei dem Einsatz von Mitteln für den Kauf von Gegenständen von Bedarf. Auch bei dem Verlangen nach Leistungen, die andere für dich erbringen, wie z.B. einem Haarschnitt beim Friseur, einer Kleider-Reinigung oder einer Bankberatung, spricht man von Bedarf. ",Was bedeutet Bedarf im Wirtschaftskontext? <true-false>Was bedeutet Bedarf im Wirtschaftskontext?<true-false>Die Aussage ist falsch,Was bedeutet Bedarf im Wirtschaftskontext?,"Kannst du bestätigen, dass man nicht nur bei dem Einsatz von Mitteln für den Kauf von Gegenständen von Bedarf spricht? <true-false>Kannst du bestätigen, dass man nicht nur bei dem Einsatz von Mitteln für den Kauf von Gegenständen von Bedarf spricht?<true-false>Die Aussage ist falsch","Kannst du bestätigen, dass man nicht nur bei dem Einsatz von Mitteln für den Kauf von Gegenständen von Bedarf spricht?","Ist es wahr oder falsch, dass der Bedarf in der Wirtschaft etwas anderes als das Bedürfnis ist? <true-false>Ist es wahr oder falsch, dass der Bedarf in der Wirtschaft etwas anderes als das Bedürfnis ist?<true-false>Die Aussage ist falsch","Ist es wahr oder falsch, dass der Bedarf in der Wirtschaft etwas anderes als das Bedürfnis ist?",Explizit,2 (Mit Bezug),Stufe 1 (Wissen/Reproduktion),true-false,leicht,"Was bedeutet Bedarf im Wirtschaftskontext?, Die Aussage ist falsch, Kannst du bestätigen, dass man nicht nur bei dem Einsatz von Mitteln für den Kauf von Gegenständen von Bedarf spricht?, Die Aussage ist falsch, Ist es wahr oder falsch, dass der Bedarf in der Wirtschaft etwas anderes als das Bedürfnis ist?, Die Aussage ist falsch",True,"[False, True, True]","[True, True, True]","[3.0, 3.4, 3.6]",Implizit,Nicht Enthalten,Enthalten,Nicht Enthalten,Enthalten,Nicht Enthalten,Nicht Enthalten,True,True,5,True,Enthalten,Enthalten,Nicht Enthalten,Nicht Enthalten,Nicht Enthalten,Enthalten,Enthalten,Nicht Enthalten,Enthalten,Nicht Enthalten,Enthalten,Enthalten,Enthalten,Enthalten,Enthalten,Nicht Enthalten,Nicht Enthalten,Nicht Enthalten,Enthalten,Nicht Enthalten,Nicht Enthalten,Nicht Enthalten,Enthalten,Nicht Enthalten
184-sys-4,stammaufgabe,mapping,"Güter dienen der Bedürfnisbefriedigung Tom hat Hunger. Er möchte sich einen Apfel kaufen, um seinen Hunger zu stillen. Du hast bereits gelernt, dass sich hinter diesem alltäglichen Vorgang in der Wirtschaftslehre ganz bestimmte Begriffe „verstecken“: Toms Wunsch, etwas zu essen, bezeichnet man als Bedürfnis. Das konkrete Verlangen nach einem Apfel als Bedarf. Jetzt kommt noch ein neues Wort dazu: Den Apfel selbst bezeichnet man in der Wirtschaftslehre als ein Gut. Güter sind Dinge oder Tätigkeiten, die der Bedürfnisbefriedigung dienen. Der Apfel ist z.B. ein Gut, da er dazu dient, Toms Bedürfnis etwas zu essen zu befriedigen. Schau dich in diesem Moment mal um, du bist ständig von Gütern umgeben: Die Kleidung, die du trägst, ist ein Gut (befriedigt das Bedürfnis nach Wärme). Das Handy, das du vielleicht in deiner Hosentasche hast, ist ein Gut (befriedigt sehr viele Bedürfnisse, z.B. das nach Unterhaltung) und auch das Wasser, das du vielleicht gerade trinken wolltest, ist ein Gut (befriedigt deinen Durst). Vorsicht! Nicht nur Dinge, die man anfassen kann, sind Güter. Im Kasten heißt es ja “Güter sind Dinge oder Tätigkeiten, die der Bedürfnisbefriedigung dienen”. Auch Tätigkeiten, die man für andere erbringt und Bedürfnisse befriedigen, bezeichnet man als Gut (z.B. ein Friseurbesuch oder eine Autoreparatur). Solche Güter nennt man Dienstleistungen. Güter, die man anfassen kann, nennt man Sachgüter.  ",Ordne die Begriffe den richtigen Erklärungen zu. <start-option>Bedürfnisse<start-option>Nachfrage<start-option>Angebot<start-option>Markt<end-option>Wünsche von Menschen<end-option>Was Kunden kaufen wollen<end-option>Was Unternehmen anbieten<end-option>Ort des Tauschens,"Was ist ein Beispiel für eine Tätigkeit, die als Dienstleistung gilt?",Ordne die Begriffe den richtigen Erklärungen zu. <start-option>Bedürfnisse<start-option>Nachfrage<start-option>Angebot<start-option>Markt<end-option>Wünsche von Menschen<end-option>Was Kunden kaufen wollen<end-option>Was Unternehmen anbieten<end-option>Ort des Tauschens,Welche Art von Gut bezeichnet man als Sachgut?,Ordne die Begriffe den richtigen Erklärungen zu. <start-option>Bedürfnisse<start-option>Nachfrage<start-option>Angebot<start-option>Markt<end-option>Wünsche von Menschen<end-option>Was Kunden kaufen wollen<end-option>Was Unternehmen anbieten<end-option>Ort des Tauschens,In welchem Szenario wäre ein Besuch eines Friseurs ein gut?,Implizit,0 (Kein Bezug),Stufe 2 (Anwendung/Transfer),mapping,stammaufgabe,"Bedürfnisse, Nachfrage, Angebot, Markt, Wünsche von Menschen, Was Kunden kaufen wollen, Was Unternehmen anbieten, Ort des Tauschens, Bedürfnisse, Nachfrage, Angebot, Markt, Wünsche von Menschen, Was Kunden kaufen wollen, Was Unternehmen anbieten, Ort des Tauschens, Bedürfnisse, Nachfrage, Angebot, Markt, Wünsche von Menschen, Was Kunden kaufen wollen, Was Unternehmen anbieten, Ort des Tauschens",True,"[False, False, False]","[True, True, True]","[3.0, 3.0, 3.0]",Nicht vorhanden,Enthalten,Enthalten,Nicht Enthalten,Nicht Enthalten,Enthalten,Enthalten,True,True,5,True,Nicht Enthalten,Nicht Enthalten,Enthalten,Enthalten,Nicht Enthalten,Enthalten,Nicht Enthalten,Enthalten,Enthalten,Enthalten,Enthalten,Enthalten,Nicht Enthalten,Nicht Enthalten,Nicht Enthalten,Enthalten,Nicht Enthalten,Nicht Enthalten,Nicht Enthalten,Enthalten,Nicht Enthalten,Enthalten,Enthalten,Nicht Enthalten
187-sys-5,schwer,multiple-choice,"Knappheit Einige Güter kann man haben, ohne dafür bezahlen zu müssen. Denk z.B. an die Luft zum Atmen: Da diese Güter niemandem gehören, können sie unbegrenzt und ohne Bezahlung genutzt werden. Solche Güter nennt man freie Güter. Je knapper ein Gut ist, desto höher ist i.d.R. sein Preis. Freie Güter zeichnen sich dadurch aus, dass sie kostenlos sind. Leider trifft dies nur auf sehr wenige Güter zu. Von den meisten Gütern gibt es nicht so viel, dass jeder Mensch einfach so viel davon haben kann, wie er will. Solche Güter nennt man knappe Güter. Knappheit liegt also dann vor, wenn ein Gut nur in einer geringeren Menge als gewünscht vorhanden ist. Es gibt dabei jedoch zwei Arten von Knappheit, bei denen genauer betrachtet wird, warum einige Menschen nicht so viel von einem Gut haben können, wie sie wollen: Absolute Knappheit liegt dann vor, wenn ein Gut zu einer bestimmten Zeit und an einem bestimmten Ort nicht oder nur in sehr begrenzter Menge vorhanden ist, z.B. Wasser in der Wüste. Für Relative Knappheit ist die Menge, in der ein Gut vorhanden ist, zweitrangig. Relative Knappheit kann auch vorliegen, wenn es sehr viel von einem Gut gibt. Entscheidend ist allein, dass die Mittel der Menschen nicht ausreichen und sie somit nicht so viel von einem Gut haben können, wie sie wollen. ",Was ist ein Merkmal von freien Gütern? <option>Sie sind nur für eine begrenzte Zeit verfügbar.<option>Sie können kostenlos genutzt werden.<option>Sie sind immer knapp.<option>Sie müssen bezahlt werden.<option>Zusätzliche Option 5<option>Zusätzliche Option 6,"Was ist ein Merkmal von freien Gütern?

A) Sie sind nur für eine begrenzte Zeit verfügbar.
B) Sie können kostenlos genutzt werden.
C) Sie sind immer knapp.
D) Sie müssen bezahlt werden.","Welche Art der Knappheit liegt vor, wenn die Menge eines Gutes zwar vorhanden ist, aber die Mittel der Menschen nicht ausreichen, um es so viel zu haben, wie sie wollen? <option>Absolute Knappheit<option>Relative Knappheit<option>Keine Knappheit<option>Unbekannt<option>Zusätzliche Option 5<option>Zusätzliche Option 6","Welche Art der Knappheit liegt vor, wenn die Menge eines Gutes zwar vorhanden ist, aber die Mittel der Menschen nicht ausreichen, um es so viel zu haben, wie sie wollen?

A) Absolute Knappheit
B) Relative Knappheit
C) Keine Knappheit
D) Unbekannt",Welche Art der Knappheit bezieht sich auf die Verfügbarkeit eines Gutes an einem bestimmten Ort und zu einer bestimmten Zeit? <option>Absolute Knappheit<option>Relative Knappheit<option>Keine Knappheit<option>Unbekannt<option>Zusätzliche Option 5<option>Zusätzliche Option 6,"Welche Art der Knappheit bezieht sich auf die Verfügbarkeit eines Gutes an einem bestimmten Ort und zu einer bestimmten Zeit?

A) Absolute Knappheit
B) Relative Knappheit
C) Keine Knappheit
D) Unbekannt",Explizit,1 (Mit Bezug),Stufe 1 (Wissen/Reproduktion),multiple-choice,schwer,"Sie sind nur für eine begrenzte Zeit verfügbar., Sie können kostenlos genutzt werden., Sie sind immer knapp., Sie müssen bezahlt werden., Zusätzliche Option 5, Zusätzliche Option 6, Absolute Knappheit, Relative Knappheit, Keine Knappheit, Unbekannt, Zusätzliche Option 5, Zusätzliche Option 6, Absolute Knappheit, Relative Knappheit, Keine Knappheit, Unbekannt, Zusätzliche Option 5, Zusätzliche Option 6",True,"[True, False, False]","[True, True, True]","[3.2, 3.6, 3.2]",Explizit,Nicht Enthalten,Nicht Enthalten,Enthalten,Enthalten,Nicht Enthalten,Nicht Enthalten,True,True,5,True,Enthalten,Nicht Enthalten,Enthalten,Nicht Enthalten,Enthalten,Enthalten,Enthalten,Enthalten,Enthalten,Nicht Enthalten,Nicht Enthalten,Nicht Enthalten,Enthalten,Nicht Enthalten,Nicht Enthalten,Nicht Enthalten,Enthalten,Nicht Enthalten,Enthalten,Enthalten,Nicht Enthalten,Nicht Enthalten,Nicht Enthalten,Enthalten
185-sys-6,leicht,single-choice,"Minimal- und Maximalprinzip Wir können nicht zu jeder Zeit alles haben, was wir wollen. Die allgegenwärtige Knappheit – unbegrenzte Bedürfnisse auf der einen Seite, begrenzte Mittel zu deren Befriedigung auf der anderen Seite – erfordert, dass wir uns für bestimmte Handlungsalternativen entscheiden: Manchmal muss man sich entscheiden, ob man Freitagabend mit Freunden ins Kino geht oder jobbt. Für beides gleichzeitig hat man keine Zeit.  Manchmal muss man sich entschieden, ob man sich von seinem Taschengeld eine neue Jacke oder neue Schuhe kauft. Für beides zusammen hat man vielleicht nicht genug Geld.  Jede Entscheidung ist mit Kosten und Nutzen verbunden. Wenn du Freitagabends ins Kino gehst, entstehen für dich z.B. die Kosten für das Kinoticket. Der Nutzen des Kinobesuchs ist z.B., dass du Spaß hast und unterhalten wirst.  Unsere Entscheidungen orientieren sich in der Regel an zwei grundlegenden ökonomischen Prinzipien: Maximalprinzip: Wir versuchen, mit den gegebenen Mitteln (Geld, Zeit, …) größtmöglichen Nutzen zu erzielen.  Minimalprinzip: Wir versuchen, ein bestimmtes Ziel mit einem möglichst geringen Einsatz an Mitteln zu erreichen Willst du wissen, ob eine Handlung dem Minimal- oder Maximalprinzip folgt? Frag dich zuerst: Was ist gegeben, das Ziel (→ Minimalprinzip) oder die Mittel (→ Maximalprinzip)? ","Was ist gegeben, wenn du Freitagabends ins Kino gehst? <option>Das Ziel ist gegeben<option>Die Mittel sind gegeben<option>Beides ist gegeben<option>Option 4","Was ist gegeben, wenn du Freitagabends ins Kino gehst? 
A) Das Ziel ist gegeben
B) Die Mittel sind gegeben
C) Beides ist gegeben","Willst du wissen, ob eine Handlung dem Minimal- oder Maximalprinzip folgt? Frag dich zuerst: <option>Was ist dein Ziel?<option>Welche Mittel hast du?<option>Beides ist irrelevant<option>Option 4","Willst du wissen, ob eine Handlung dem Minimal- oder Maximalprinzip folgt? Frag dich zuerst:
A) Was ist dein Ziel?
B) Welche Mittel hast du?
C) Beides ist irrelevant","Was ist das Ziel, wenn wir versuchen, ein bestimmtes Ziel mit einem möglichst geringen Einsatz an Mitteln zu erreichen? <option>Wir wollen ein Maximum erzielen<option>Wir wollen ein Minimum erzielen<option>Es ist egal<option>Option 4","Was ist das Ziel, wenn wir versuchen, ein bestimmtes Ziel mit einem möglichst geringen Einsatz an Mitteln zu erreichen?
A) Wir wollen ein Maximum erzielen
B) Wir wollen ein Minimum erzielen
C) Es ist egal",Implizit,2 (Mit Bezug),Stufe 2 (Anwendung/Transfer),single-choice,leicht,"Das Ziel ist gegeben, Die Mittel sind gegeben, Beides ist gegeben, Option 4, Was ist dein Ziel?, Welche Mittel hast du?, Beides ist irrelevant, Option 4, Wir wollen ein Maximum erzielen, Wir wollen ein Minimum erzielen, Es ist egal, Option 4",True,"[False, False, False]","[True, True, True]","[3.6, 2.8, 3.4]",Implizit,Enthalten,Nicht Enthalten,Enthalten,Nicht Enthalten,Enthalten,Enthalten,True,True,5,True,Nicht Enthalten,Enthalten,Enthalten,Enthalten,Enthalten,Enthalten,Nicht Enthalten,Nicht Enthalten,Nicht Enthalten,Enthalten,Nicht Enthalten,Nicht Enthalten,Nicht Enthalten,Enthalten,Nicht Enthalten,Enthalten,Enthalten,Nicht Enthalten,Nicht Enthalten,Nicht Enthalten,Enthalten,Enthalten,Nicht Enthalten,Enthalten
186-sys-7,stammaufgabe,true-false,"Opportunitätskosten  Entscheidest du dich dafür, Freitagabend ins Kino zu gehen, statt zu jobben, dann entstehen dir nicht nur die Kosten für das Kinoticket. Du verzichtest auch auf das Gehalt, dass du hättest verdienen können, wenn du jobben gegangen wärst.  Das, worauf man verzichtet, wenn man sich für eine Handlungsalternative entscheidet, nennt man Opportunitätskosten (auch: Verzichtskosten). Kosten und Nutzen beziehen sich nicht allein auf Geld. Der Nutzen einer Handlung kann z.B. auch Spaß oder Erholung sein. Die Kosten einer Handlung umfassen z.B. auch die Zeit, die du brauchst, um die Handlung durchzuführen oder Güter, die für die Durchführung der Handlung benötigt werden. ",Was sind Opportunitätskosten? <true-false>Was sind Opportunitätskosten?<true-false>Die Aussage ist falsch,Was sind Opportunitätskosten?,Wann entstehen Opportunitätskosten? <true-false>Wann entstehen Opportunitätskosten?<true-false>Die Aussage ist falsch,Wann entstehen Opportunitätskosten?,Wie können Kosten und Nutzen sich auf ein Ziel auswirken? <true-false>Wie können Kosten und Nutzen sich auf ein Ziel auswirken?<true-false>Die Aussage ist falsch,Wie können Kosten und Nutzen sich auf ein Ziel auswirken?,Explizit,0 (Kein Bezug),Stufe 1 (Wissen/Reproduktion),true-false,stammaufgabe,"Was sind Opportunitätskosten?, Die Aussage ist falsch, Wann entstehen Opportunitätskosten?, Die Aussage ist falsch, Wie können Kosten und Nutzen sich auf ein Ziel auswirken?, Die Aussage ist falsch",True,"[True, False, False]","[True, True, True]","[3.4, 3.0, 2.8]",Nicht vorhanden,Nicht Enthalten,Enthalten,Enthalten,Enthalten,Nicht Enthalten,Nicht Enthalten,True,True,5,True,Enthalten,Enthalten,Enthalten,Nicht Enthalten,Nicht Enthalten,Nicht Enthalten,Enthalten,Nicht Enthalten,Nicht Enthalten,Nicht Enthalten,Enthalten,Nicht Enthalten,Enthalten,Enthalten,Nicht Enthalten,Nicht Enthalten,Nicht Enthalten,Enthalten,Enthalten,Nicht Enthalten,Enthalten,Nicht Enthalten,Enthalten,Enthalten
