189-sys-8,schwer,mapping,"Verteilungsmechanismus ohne Markt Die Mitglieder der Band „Economics“, kommen für ein Konzert in ihre Heimatstadt. Sie treten in dem kleinen Club auf, in dem sie ihr erstes Konzert gegeben haben. Allerdings ist hier nur Platz für 300 Menschen. Da nicht genug Plätze für alle da sind, muss die Band entscheiden, wer eines der Tickets bekommt. Hierfür gibt es verschiedene Ansätze: <image>Zuteilung: Die Band könnte die Konzertkarten einfach an die alten Bekannten verteilen. Oder sie verteilt die Tickets an die ältesten Interessenten. Wenn knappe Güter von jemandem aufgrund festgelegter Kriterien verteilt werden, spricht man vom Verteilungsmechanismus der Zuteilung.  <image>Windhund-Verfahren: Natürlich könnte die Band die Tickets auch an die Personen verteilen, die sie als erstes um eines bitten. Nach dem Motto: Wer zuerst kommt – mahlt zuerst. Dieser Verteilungsmechanismus, bei dem diejenigen die Güter bekommen, die zuerst nach ihnen verlangen, wird als Windhund-Verfahren bezeichnet. <image>Verlosung: Alternativ könnten sie auch den Zufall entscheiden lassen. Zum Beispiel könnten die „Economics“ Lose verteilen und die Gewinner bekämen eines der Tickets. Dieser Verteilungsmechanismus, der auf Zufall basiert, wird Verlosung genannt. ",Ordne die Begriffe den richtigen Erklärungen zu. <start-option>Bedürfnisse<start-option>Nachfrage<start-option>Angebot<start-option>Markt<end-option>Wünsche von Menschen<end-option>Was Kunden kaufen wollen<end-option>Was Unternehmen anbieten<end-option>Ort des Tauschens,"Wer erhält eines der Tickets? <start-option>Die Mitglieder der Band</start-option><end-option>Die alten Bekannten</end-option><start-option>Die ältesten Interessenten</start-option><end-option>Der erste, der um ein Ticket bittet</end-option>",Ordne die Begriffe den richtigen Erklärungen zu. <start-option>Bedürfnisse<start-option>Nachfrage<start-option>Angebot<start-option>Markt<end-option>Wünsche von Menschen<end-option>Was Kunden kaufen wollen<end-option>Was Unternehmen anbieten<end-option>Ort des Tauschens,"Wer erhält eines der Tickets? <start-option>Die Mitglieder der Band</start-option><end-option>Die alten Bekannten</end-option><start-option>Der erste, der um ein Ticket bittet</end-option><end-option>Ein Gewinner aus einer Verlosung</end-option>",Ordne die Begriffe den richtigen Erklärungen zu. <start-option>Bedürfnisse<start-option>Nachfrage<start-option>Angebot<start-option>Markt<end-option>Wünsche von Menschen<end-option>Was Kunden kaufen wollen<end-option>Was Unternehmen anbieten<end-option>Ort des Tauschens,"Wer erhält eines der Tickets? <start-option>Der erste, der um ein Ticket bittet</start-option><end-option>Ein Gewinner aus einer Verlosung</end-option><start-option>Die alten Bekannten</start-option><end-option>Die Mitglieder der Band</end-option>",Implizit,1 (Mit Bezug),Stufe 2 (Anwendung/Transfer),mapping,schwer,"Bedürfnisse, Nachfrage, Angebot, Markt, Wünsche von Menschen, Was Kunden kaufen wollen, Was Unternehmen anbieten, Ort des Tauschens, Bedürfnisse, Nachfrage, Angebot, Markt, Wünsche von Menschen, Was Kunden kaufen wollen, Was Unternehmen anbieten, Ort des Tauschens, Bedürfnisse, Nachfrage, Angebot, Markt, Wünsche von Menschen, Was Kunden kaufen wollen, Was Unternehmen anbieten, Ort des Tauschens",True,"[False, False, False]","[True, True, True]","[3.2, 3.2, 3.2]",Explizit,Enthalten,Enthalten,Enthalten,Nicht Enthalten,Enthalten,Enthalten,True,True,5,True,Nicht Enthalten,Nicht Enthalten,Nicht Enthalten,Enthalten,Nicht Enthalten,Nicht Enthalten,Nicht Enthalten,Enthalten,Nicht Enthalten,Enthalten,Enthalten,Nicht Enthalten,Nicht Enthalten,Nicht Enthalten,Enthalten,Enthalten,Nicht Enthalten,Enthalten,Nicht Enthalten,Enthalten,Enthalten,Enthalten,Enthalten,Enthalten
195-sys-9,leicht,multiple-choice,"Verteilungsmechanismen mit Markt Die Mitglieder der Band „Economics“, kommen für ein Konzert in ihre Heimatstadt. Sie treten in dem kleinen Club auf, in dem sie ihr erstes Konzert gegeben haben. Allerdings ist hier nur Platz für 300 Menschen. Da nicht genug Plätze für alle da sind, muss die Band entscheiden, wer eines der Tickets bekommt. Hierfür haben wir dir bereits einige Ansätze vorgestellt (Zuteilung, Windhund-Verfahren und Verlosung). Hinzu kommt nun der Markt: <image>Die Band könnte sich aber auch dazu entscheiden die Konzertkarten zum Verkauf anzubieten. So bekommen nur diejenigen eine Karte, die das Konzert auch gerne besuchen möchten. Denn nur wer bereit ist Geld für ein Ticket zu bezahlen wird auch eines bekommen können. Verkaufen die „Economics“ die Konzertkarten zu einem Preis von 15 Euro wird es einige Menschen geben, die nicht bereit sind, diesen Preis zu bezahlen, um das Konzert zu sehen. Andere hingegen, die vielleicht sogar richtige Fans sind, bezahlen die 15 Euro gerne, um die Band Live zu sehen. Der Preis, den jemand bereit ist zu bezahlen, zeigt an, wie dringend jemand etwas haben möchte. Im Nachbarort hat man mitbekommen, wie gut die Verteilung der Konzertkarten über den Markt funktioniert und versucht das gleiche mit den Karten für das Puppentheater. Leider haben viele der Anwohner kein Interesse an dem Puppentheater und sind nicht bereit den Preis von 15 Euro für ein Ticket zu bezahlen. Der Nachbarort bleibt auf den Eintrittskarten sitzen und wird beim nächsten Mal eher auch ein Konzert veranstalten. Märkte sorgen also nicht nur dafür, dass diejenigen die Güter bekommen, die sie am dringendsten haben möchten, sondern auch dafür, dass tendenziell nur solche Güter hergestellt und verkauft werden, die die Menschen auch haben wollen. Knappe Güter werden in der Regel über Märkte verteilt. In manchen Fällen werden aber auch verschiedene Verteilungsmechanismen kombiniert. Häufig ist das bei Konzertkarten der Fall. Diese werden zwar zu bestimmten Preisen verkauft (Handel auf einem Markt) und trotzdem ist es oft so, dass nur diejenigen, die auch schnell genug sind, eine Karte kaufen können (Windhund-Verfahren). Der Verteilungsmechanismus Markt ist im Grunde ein Tausch. Man könnte eigentlich mit allem tauschen, aber in der Regel tauschen wir mit Geld. Das vereinfacht das Wirtschaftsleben erheblich, weil es den Wert von Gütern über eine Recheneinheit vergleichbar macht. Ohne Geld müssten die einzelnen Tauschverhältnisse untereinander bestimmt werden: Eier in Äpfel, Eier in Salz, Salz in Kleidung. Dank des Geldes hat man ein einheitliches Tauschmittel. So können auch sehr unterschiedliche Dinge miteinander verglichen werden. ","Wer erhält ein Konzertticket, wenn es über den Markt verkauft wird? <option>Nur wer das Konzert gerne sehen möchte<option>Jeder, der ein Ticket kaufen kann<option>Derjenige, der das teuerste Angebot gibt<option>Keiner, weil die Tickets nicht verkauft werden<option>Zusätzliche Option 5<option>Zusätzliche Option 6","Wer erhält ein Konzertticket, wenn es über den Markt verkauft wird?

A) Nur wer das Konzert gerne sehen möchte
B) Jeder, der ein Ticket kaufen kann
C) Derjenige, der das teuerste Angebot gibt
D) Keiner, weil die Tickets nicht verkauft werden","Welchen Effekt hat der Markt auf den Warenbestand? <option>Er erhöht ihn<option>Er senkt ihn<option>Er sorgt dafür, dass nur diejenigen Güter hergestellt und verkauft werden, die die Menschen wollen<option>Er sorgt dafür, dass alle Güter verkaufbar sind<option>Zusätzliche Option 5<option>Zusätzliche Option 6","Welchen Effekt hat der Markt auf den Warenbestand?

A) Er erhöht ihn
B) Er senkt ihn
C) Er sorgt dafür, dass nur diejenigen Güter hergestellt und verkauft werden, die die Menschen wollen
D) Er sorgt dafür, dass alle Güter verkaufbar sind",Was ist das einheitliche Tauschmittel im Wirtschaftsleben? <option>Geld<option>Zeit<option>Arbeit<option>Energie<option>Zusätzliche Option 5<option>Zusätzliche Option 6,"Was ist das einheitliche Tauschmittel im Wirtschaftsleben?

A) Geld
B) Zeit
C) Arbeit
D) Energie",Explizit,2 (Mit Bezug),Stufe 1 (Wissen/Reproduktion),multiple-choice,leicht,"Nur wer das Konzert gerne sehen möchte, Jeder, der ein Ticket kaufen kann, Derjenige, der das teuerste Angebot gibt, Keiner, weil die Tickets nicht verkauft werden, Zusätzliche Option 5, Zusätzliche Option 6, Er erhöht ihn, Er senkt ihn, Er sorgt dafür, dass nur diejenigen Güter hergestellt und verkauft werden, die die Menschen wollen, Er sorgt dafür, dass alle Güter verkaufbar sind, Zusätzliche Option 5, Zusätzliche Option 6, Geld, Zeit, Arbeit, Energie, Zusätzliche Option 5, Zusätzliche Option 6",True,"[True, False, False]","[True, True, True]","[3.6, 3.2, 3.8]",Implizit,Nicht Enthalten,Nicht Enthalten,Nicht Enthalten,Enthalten,Nicht Enthalten,Nicht Enthalten,True,True,5,True,Enthalten,Nicht Enthalten,Nicht Enthalten,Nicht Enthalten,Enthalten,Nicht Enthalten,Enthalten,Enthalten,Nicht Enthalten,Nicht Enthalten,Nicht Enthalten,Enthalten,Enthalten,Nicht Enthalten,Enthalten,Nicht Enthalten,Enthalten,Enthalten,Enthalten,Enthalten,Enthalten,Nicht Enthalten,Nicht Enthalten,Nicht Enthalten
188-sys-10,stammaufgabe,single-choice,"Anbieter und Nachfrager auf Märkten Märkte sind Treffpunkte von Angebot und Nachfrage. Bei uns werden die meisten Güter über Märkte verteilt. Doch was genau ist so ein Markt? Die Nachfrage ist die Menge an Gütern, die Nachfrager und Nachfragerinnen auf Märkten kaufen wollen. Erinnerst du dich an das Konzertkarten-Beispiel? Hier sind die Fans die Nachfragerinnen und Nachfrager, denn sie wollen eine der Konzertkarten kaufen. Das Ziel der Nachfragerinnen und Nachfrager ist es, die Güter, die sie zur Befriedigung ihrer Bedürfnisse benötigen, zu möglichst niedrigen Preisen einzukaufen. Alltagssprache vs. Fachsprache: In der Alltagssprache sprechen wir auch von einer Nachfrage, wenn man etwas nicht verstanden hat. In der Fachsprache der Wirtschaft ist die Nachfrage die Menge an Gütern, die Käuferinnen und Käufer auf Märkten erwerben wollen. Das Angebot ist die Summe aller angebotenen Güter auf einem Markt. In dem Konzertkarten-Beispiel sind die Tickets, die die zum Verkauf stehen, das Angebot. In diesem Beispiel ist also der Konzertveranstalter der Anbieter. Anbieter wollen ihre Sachgüter oder Dienstleistungen auf Märkten verkaufen oder tauschen. Dabei ist ihr Ziel einen möglichst hohen Preis zu erzielen.  ","Was genau ist die Nachfrage in der Wirtschaft? <option>Die Menge an Gütern, die Anbieter auf Märkten verkaufen wollen<option>Die Summe aller angebotenen Güter auf einem Markt<option>Die Menge an Gütern, die Käuferinnen und Käufer auf Märkten erwerben wollen<option>Das Angebot","Was genau ist die Nachfrage in der Wirtschaft?

A) Die Menge an Gütern, die Anbieter auf Märkten verkaufen wollen
B) Die Summe aller angebotenen Güter auf einem Markt
C) Die Menge an Gütern, die Käuferinnen und Käufer auf Märkten erwerben wollen
D) Das Angebot",Was ist das Ziel der Anbieter? <option>Einen möglichst niedrigen Preis zu erzielen<option>Ein bestimmtes Produkt zu verkaufen<option>Die Nachfrage zu maximieren<option>Einen möglichst hohen Preis zu erzielen,"Was ist das Ziel der Anbieter?

A) Einen möglichst niedrigen Preis zu erzielen
B) Ein bestimmtes Produkt zu verkaufen
C) Die Nachfrage zu maximieren
D) Einen möglichst hohen Preis zu erzielen","Was ist ein Markt? <option>Ein Ort, an dem Güter gekauft und verkauft werden<option>Ein Ort, an dem Anbieter ihre Sachgüter oder Dienstleistungen verkaufen wollen<option>Ein Ort, an dem die Nachfrage maximiert wird<option>Ein Ort, an dem der Preis niedrig ist","Was ist ein Markt?

A) Ein Ort, an dem Güter gekauft und verkauft werden
B) Ein Ort, an dem Anbieter ihre Sachgüter oder Dienstleistungen verkaufen wollen
C) Ein Ort, an dem die Nachfrage maximiert wird
D) Ein Ort, an dem der Preis niedrig ist",Implizit,0 (Kein Bezug),Stufe 2 (Anwendung/Transfer),single-choice,stammaufgabe,"Die Menge an Gütern, die Anbieter auf Märkten verkaufen wollen, Die Summe aller angebotenen Güter auf einem Markt, Die Menge an Gütern, die Käuferinnen und Käufer auf Märkten erwerben wollen, Das Angebot, Einen möglichst niedrigen Preis zu erzielen, Ein bestimmtes Produkt zu verkaufen, Die Nachfrage zu maximieren, Einen möglichst hohen Preis zu erzielen, Ein Ort, an dem Güter gekauft und verkauft werden, Ein Ort, an dem Anbieter ihre Sachgüter oder Dienstleistungen verkaufen wollen, Ein Ort, an dem die Nachfrage maximiert wird, Ein Ort, an dem der Preis niedrig ist",True,"[False, False, False]","[True, True, True]","[3.2, 3.2, 3.0]",Nicht vorhanden,Enthalten,Nicht Enthalten,Nicht Enthalten,Nicht Enthalten,Enthalten,Enthalten,True,True,5,True,Nicht Enthalten,Enthalten,Nicht Enthalten,Enthalten,Enthalten,Nicht Enthalten,Nicht Enthalten,Nicht Enthalten,Enthalten,Enthalten,Nicht Enthalten,Enthalten,Nicht Enthalten,Enthalten,Enthalten,Enthalten,Enthalten,Enthalten,Nicht Enthalten,Nicht Enthalten,Nicht Enthalten,Enthalten,Nicht Enthalten,Nicht Enthalten
20-sys-12,leicht,mapping,"Modelle Modelle helfen uns, die Wirklichkeit zu verstehen, aber bilden sie nicht vollständig ab. <image>Modelle vereinfachen die Wirklichkeit, damit wir sie besser verstehen. Eine Straßenkarte, wie man sie häufig auch in Navigationsapps sieht, ist z. B. eine vereinfachte Anschauungsversion des richtigen Straßennetzes. Sie ist ein Abbild der Straßen, Wege und Plätze. Die Stadt oder der Ort sieht in Wirklichkeit jedoch anders aus. !Aber Vorsicht! Modelle bilden die Wirklichkeit nie vollständig ab. Wer allein ein Modellauto betrachtet, könnte z. B. denken, Autos enthielten keinen Motor. Damit ein Modell funktioniert, muss man daher bestimmte Modellannahmen treffen. Ein Modellauto z.B. taugt nur dann als Anschauung eines richtigen Autos, wenn man sich bewusst ist, dass die Technik (Motor, Elektronik, etc.) im Modell vernachlässigt wird. Die Straßenkarte beschränkt sich also auf die für uns wesentlichen Informationen (Wo ist welche Straße? / Welcher Weg ist der schnellste?), ohne dass wir tatsächlich vor Ort sein müssen. Modelle lenken so den Fokus auf das Wesentliche der Sache, die sie abbilden. Modelle sind aber nicht immer auch konkrete Gegenstände wie das Modellauto, der Stadtplan oder ein Globus. Häufig werden sogenannte Denkmodelle genutzt, um besonders komplizierte Zusammenhänge besser zu verstehen. Ein Beispiel dafür ist das in der Wirtschaft häufig genutzte Preisbildungsmodell. ","Wie kann man Modelle verstehen, die die Wirklichkeit abbilden? <start-option>Bedürfnisse<start-option>Nachfrage<start-option>Angebot<start-option>Markt<end-option>Wünsche von Menschen<end-option>Was Kunden kaufen wollen<end-option>Was Unternehmen anbieten<end-option>Ort des Tauschens","Wie kann man Modelle verstehen, die die Wirklichkeit abbilden?
<start-option>Modelle sind vollständige Abbilder der Wirklichkeit</start-option>
<option>Modelle vereinfachen die Wirklichkeit, damit wir sie besser verstehen</option>
<option>Modelle bilden die Wirklichkeit nie vollständig ab</option>
<end-option>",Was ist ein Beispiel für eine Straßenkarte als Modell der Wirklichkeit? <start-option>Bedürfnisse<start-option>Nachfrage<start-option>Angebot<start-option>Markt<end-option>Wünsche von Menschen<end-option>Was Kunden kaufen wollen<end-option>Was Unternehmen anbieten<end-option>Ort des Tauschens,"Was ist ein Beispiel für eine Straßenkarte als Modell der Wirklichkeit?
Straßenkarten zeigen das tatsächliche Straßennetz
Straßenkarten vereinfachen die Wirklichkeit, damit wir sie besser verstehen
Eine Straßenkarte ist ein Abbild des richtigen Straßennetzes, aber nicht vollständig
<start-option>Betrachten Sie eine Straßenkarte als Modell der Wirklichkeit</start-option>
<option>Ein Straßenplan ist ein Beispiel für ein Modell der Wirklichkeit</option>
<end-option>","Was muss man wissen, um Modelle zu verstehen? <start-option>Bedürfnisse<start-option>Nachfrage<start-option>Angebot<start-option>Markt<end-option>Wünsche von Menschen<end-option>Was Kunden kaufen wollen<end-option>Was Unternehmen anbieten<end-option>Ort des Tauschens","Was muss man wissen, um Modelle zu verstehen?
Man muss sich daran erinnern, dass Modelle vollständige Abbilder sind
Modelle bilden die Wirklichkeit nie vollständig ab
Man muss sich bewusst sein, dass Modelle bestimmte Modellannahmen treffen müssen
<start-option>Modelle sind vollständige Abbilder der Wirklichkeit</start-option>
<option>Man muss sich daran erinnern, dass Modelle bestimmte Annahmen treffen müssen</option>
<end-option>",Implizit,2 (Mit Bezug),Stufe 2 (Anwendung/Transfer),mapping,leicht,"Bedürfnisse, Nachfrage, Angebot, Markt, Wünsche von Menschen, Was Kunden kaufen wollen, Was Unternehmen anbieten, Ort des Tauschens, Bedürfnisse, Nachfrage, Angebot, Markt, Wünsche von Menschen, Was Kunden kaufen wollen, Was Unternehmen anbieten, Ort des Tauschens, Bedürfnisse, Nachfrage, Angebot, Markt, Wünsche von Menschen, Was Kunden kaufen wollen, Was Unternehmen anbieten, Ort des Tauschens",True,"[False, True, True]","[True, True, True]","[3.6, 3.4, 3.2]",Implizit,Enthalten,Enthalten,Nicht Enthalten,Nicht Enthalten,Enthalten,Enthalten,True,True,5,True,Nicht Enthalten,Nicht Enthalten,Enthalten,Enthalten,Nicht Enthalten,Enthalten,Nicht Enthalten,Enthalten,Enthalten,Enthalten,Enthalten,Enthalten,Nicht Enthalten,Nicht Enthalten,Nicht Enthalten,Enthalten,Nicht Enthalten,Nicht Enthalten,Nicht Enthalten,Enthalten,Nicht Enthalten,Enthalten,Enthalten,Nicht Enthalten
19-sys-13,stammaufgabe,multiple-choice,"Preisbildungsmodell Du hast schon gelernt, dass auf Märkten ein Zusammentreffen von Angebot und Nachfrage stattfindet. Um Güter gegen Geld zu tauschen, bildet sich dabei ein Preis, aber wie funktioniert das genau? Betrachten wir dafür ein Beispiel. Stell dir vor, du besitzt eine seltene Sammelkarte und möchtest diese verkaufen. Mechanismus Nr. 1 (Nachfrage): Je höher die Nachfrage, desto höher ist tendenziell der Preis. Umgekehrt gilt: Je geringer die Nachfrage, desto geringer ist tendenziell der Preis. Wenn sich nur eine Person für deine Sammelkarte interessiert, wirst du sie vermutlich nicht so teuer verkaufen können. Interessieren sich dagegen zehn Personen für sie (höhere Nachfrage), kannst du vermutlich einen höheren Preis erzielen. Die Interessenten konkurrieren dann um deine Sammelkarte – und überbieten sich hoffentlich gegenseitig. Mechanismus Nr. 2 (Angebot): Je höher das Angebot, desto geringer ist tendenziell der Preis. Umgekehrt gilt: Je geringer das Angebot, desto höher ist tendenziell der Preis. Stell dir vor, ein Mitschüler taucht auf und besitzt gleich mehrere Exemplare deiner Sammelkarte, die er ebenfalls verkaufen möchte (höheres Angebot). Die Interessenten können sich jetzt zwischen euch und euren Angeboten entscheiden – und du musst deine Preisvorstellung vielleicht nach unten korrigieren, damit du deine Karte trotz der Konkurrenz durch deinen Mitschüler loswirst. Mechanismus Nr. 3 (Preis): Je höher der Preis, desto geringer ist die Nachfrage und desto höher das Angebot. Je geringer der Preis, desto höher ist die Nachfrage und desto geringer das Angebot. Grundsätzlich gilt: Je höher der Preis deiner Sammelkarte ist, desto weniger deiner Mitschüler*innen werden diese kaufen wollen. Gleichzeitig ist der Preis auch für die Anbieter*innen wichtig: Je teurer man die Karte verkaufen kann, desto mehr Leute sind bereit, ihre Karten anzubieten. <image>","Was ist der Hauptgrund dafür, warum ein hoher Preis für eine Sammelkarte tendenziell zu einer geringeren Nachfrage führt? <option>Weil die Leute mehr Geld haben<option>Weil sie die Karte nicht so gerne haben<option>Weil das Angebot höher wird<option>Weil die Nachfrage nach dem Geld steigt<option>Zusätzliche Option 5<option>Zusätzliche Option 6","Was ist der Hauptgrund dafür, warum ein hoher Preis für eine Sammelkarte tendenziell zu einer geringeren Nachfrage führt?

A) Weil die Leute mehr Geld haben
B) Weil sie die Karte nicht so gerne haben
C) Weil das Angebot höher wird
D) Weil die Nachfrage nach dem Geld steigt","Welches von den folgenden Szenarien zeigt, wie ein hoher Preis zu einem höheren Angebot führen kann? <option>Wenn nur eine Person für die Sammelkarte interessiert ist und sie hochpreisen möchte<option>Wenn zehn Personen für die Karte interessiert sind, aber der Verkäufer dennoch einen hohen Preis verlangt<option>Wenn ein Mitschüler taucht auf und mehrere Exemplare der Sammelkarte besitzt, um sie zu überbieten<option>Wenn niemand für die Karte interessiert ist und sie deshalb keinen Preis haben kann<option>Zusätzliche Option 5<option>Zusätzliche Option 6","Welches von den folgenden Szenarien zeigt, wie ein hoher Preis zu einem höheren Angebot führen kann?

A) Wenn nur eine Person für die Sammelkarte interessiert ist und sie hochpreisen möchte
B) Wenn zehn Personen für die Karte interessiert sind, aber der Verkäufer dennoch einen hohen Preis verlangt
C) Wenn ein Mitschüler taucht auf und mehrere Exemplare der Sammelkarte besitzt, um sie zu überbieten
D) Wenn niemand für die Karte interessiert ist und sie deshalb keinen Preis haben kann","Wie beschreibt das Preisbildungsmodell die Beziehung zwischen Preis und Angebot? <option>Je höher der Preis, desto höher das Angebot<option>Je geringer der Preis, desto höher das Angebot<option>Je höher der Preis, desto geringer das Angebot<option>Je geringer der Preis, desto geringer das Angebot<option>Zusätzliche Option 5<option>Zusätzliche Option 6","Wie beschreibt das Preisbildungsmodell die Beziehung zwischen Preis und Angebot?

A) Je höher der Preis, desto höher das Angebot
B) Je geringer der Preis, desto höher das Angebot
C) Je höher der Preis, desto geringer das Angebot
D) Je geringer der Preis, desto geringer das Angebot",Explizit,0 (Kein Bezug),Stufe 1 (Wissen/Reproduktion),multiple-choice,stammaufgabe,"Weil die Leute mehr Geld haben, Weil sie die Karte nicht so gerne haben, Weil das Angebot höher wird, Weil die Nachfrage nach dem Geld steigt, Zusätzliche Option 5, Zusätzliche Option 6, Wenn nur eine Person für die Sammelkarte interessiert ist und sie hochpreisen möchte, Wenn zehn Personen für die Karte interessiert sind, aber der Verkäufer dennoch einen hohen Preis verlangt, Wenn ein Mitschüler taucht auf und mehrere Exemplare der Sammelkarte besitzt, um sie zu überbieten, Wenn niemand für die Karte interessiert ist und sie deshalb keinen Preis haben kann, Zusätzliche Option 5, Zusätzliche Option 6, Je höher der Preis, desto höher das Angebot, Je geringer der Preis, desto höher das Angebot, Je höher der Preis, desto geringer das Angebot, Je geringer der Preis, desto geringer das Angebot, Zusätzliche Option 5, Zusätzliche Option 6",True,"[False, False, True]","[True, True, True]","[3.0, 3.4, 3.2]",Nicht vorhanden,Nicht Enthalten,Nicht Enthalten,Enthalten,Enthalten,Nicht Enthalten,Nicht Enthalten,True,True,5,True,Enthalten,Nicht Enthalten,Enthalten,Nicht Enthalten,Enthalten,Enthalten,Enthalten,Enthalten,Enthalten,Nicht Enthalten,Nicht Enthalten,Nicht Enthalten,Enthalten,Nicht Enthalten,Nicht Enthalten,Nicht Enthalten,Enthalten,Nicht Enthalten,Enthalten,Enthalten,Nicht Enthalten,Nicht Enthalten,Nicht Enthalten,Enthalten
