20-sys-12,leicht,mapping,"Modelle Modelle helfen uns, die Wirklichkeit zu verstehen, aber bilden sie nicht vollständig ab. <image>Modelle vereinfachen die Wirklichkeit, damit wir sie besser verstehen. Eine Straßenkarte, wie man sie häufig auch in Navigationsapps sieht, ist z. B. eine vereinfachte Anschauungsversion des richtigen Straßennetzes. Sie ist ein Abbild der Straßen, Wege und Plätze. Die Stadt oder der Ort sieht in Wirklichkeit jedoch anders aus. !Aber Vorsicht! Modelle bilden die Wirklichkeit nie vollständig ab. Wer allein ein Modellauto betrachtet, könnte z. B. denken, Autos enthielten keinen Motor. Damit ein Modell funktioniert, muss man daher bestimmte Modellannahmen treffen. Ein Modellauto z.B. taugt nur dann als Anschauung eines richtigen Autos, wenn man sich bewusst ist, dass die Technik (Motor, Elektronik, etc.) im Modell vernachlässigt wird. Die Straßenkarte beschränkt sich also auf die für uns wesentlichen Informationen (Wo ist welche Straße? / Welcher Weg ist der schnellste?), ohne dass wir tatsächlich vor Ort sein müssen. Modelle lenken so den Fokus auf das Wesentliche der Sache, die sie abbilden. Modelle sind aber nicht immer auch konkrete Gegenstände wie das Modellauto, der Stadtplan oder ein Globus. Häufig werden sogenannte Denkmodelle genutzt, um besonders komplizierte Zusammenhänge besser zu verstehen. Ein Beispiel dafür ist das in der Wirtschaft häufig genutzte Preisbildungsmodell. ","Wie kann man Modelle verstehen, die die Wirklichkeit abbilden? <start-option>Bedürfnisse<start-option>Nachfrage<start-option>Angebot<start-option>Markt<end-option>Wünsche von Menschen<end-option>Was Kunden kaufen wollen<end-option>Was Unternehmen anbieten<end-option>Ort des Tauschens","Wie kann man Modelle verstehen, die die Wirklichkeit abbilden?
<start-option>Modelle sind vollständige Abbilder der Wirklichkeit</start-option>
<option>Modelle vereinfachen die Wirklichkeit, damit wir sie besser verstehen</option>
<option>Modelle bilden die Wirklichkeit nie vollständig ab</option>
<end-option>",Was ist ein Beispiel für eine Straßenkarte als Modell der Wirklichkeit? <start-option>Bedürfnisse<start-option>Nachfrage<start-option>Angebot<start-option>Markt<end-option>Wünsche von Menschen<end-option>Was Kunden kaufen wollen<end-option>Was Unternehmen anbieten<end-option>Ort des Tauschens,"Was ist ein Beispiel für eine Straßenkarte als Modell der Wirklichkeit?
Straßenkarten zeigen das tatsächliche Straßennetz
Straßenkarten vereinfachen die Wirklichkeit, damit wir sie besser verstehen
Eine Straßenkarte ist ein Abbild des richtigen Straßennetzes, aber nicht vollständig
<start-option>Betrachten Sie eine Straßenkarte als Modell der Wirklichkeit</start-option>
<option>Ein Straßenplan ist ein Beispiel für ein Modell der Wirklichkeit</option>
<end-option>","Was muss man wissen, um Modelle zu verstehen? <start-option>Bedürfnisse<start-option>Nachfrage<start-option>Angebot<start-option>Markt<end-option>Wünsche von Menschen<end-option>Was Kunden kaufen wollen<end-option>Was Unternehmen anbieten<end-option>Ort des Tauschens","Was muss man wissen, um Modelle zu verstehen?
Man muss sich daran erinnern, dass Modelle vollständige Abbilder sind
Modelle bilden die Wirklichkeit nie vollständig ab
Man muss sich bewusst sein, dass Modelle bestimmte Modellannahmen treffen müssen
<start-option>Modelle sind vollständige Abbilder der Wirklichkeit</start-option>
<option>Man muss sich daran erinnern, dass Modelle bestimmte Annahmen treffen müssen</option>
<end-option>",Implizit,2 (Mit Bezug),Stufe 2 (Anwendung/Transfer),mapping,leicht,"Bedürfnisse, Nachfrage, Angebot, Markt, Wünsche von Menschen, Was Kunden kaufen wollen, Was Unternehmen anbieten, Ort des Tauschens, Bedürfnisse, Nachfrage, Angebot, Markt, Wünsche von Menschen, Was Kunden kaufen wollen, Was Unternehmen anbieten, Ort des Tauschens, Bedürfnisse, Nachfrage, Angebot, Markt, Wünsche von Menschen, Was Kunden kaufen wollen, Was Unternehmen anbieten, Ort des Tauschens",True,"[False, True, True]","[True, True, True]","[3.6, 3.4, 3.2]",Implizit,Enthalten,Enthalten,Nicht Enthalten,Nicht Enthalten,Enthalten,Enthalten,True,True,5,True,Nicht Enthalten,Nicht Enthalten,Enthalten,Enthalten,Nicht Enthalten,Enthalten,Nicht Enthalten,Enthalten,Enthalten,Enthalten,Enthalten,Enthalten,Nicht Enthalten,Nicht Enthalten,Nicht Enthalten,Enthalten,Nicht Enthalten,Nicht Enthalten,Nicht Enthalten,Enthalten,Nicht Enthalten,Enthalten,Enthalten,Nicht Enthalten
19-sys-13,stammaufgabe,multiple-choice,"Preisbildungsmodell Du hast schon gelernt, dass auf Märkten ein Zusammentreffen von Angebot und Nachfrage stattfindet. Um Güter gegen Geld zu tauschen, bildet sich dabei ein Preis, aber wie funktioniert das genau? Betrachten wir dafür ein Beispiel. Stell dir vor, du besitzt eine seltene Sammelkarte und möchtest diese verkaufen. Mechanismus Nr. 1 (Nachfrage): Je höher die Nachfrage, desto höher ist tendenziell der Preis. Umgekehrt gilt: Je geringer die Nachfrage, desto geringer ist tendenziell der Preis. Wenn sich nur eine Person für deine Sammelkarte interessiert, wirst du sie vermutlich nicht so teuer verkaufen können. Interessieren sich dagegen zehn Personen für sie (höhere Nachfrage), kannst du vermutlich einen höheren Preis erzielen. Die Interessenten konkurrieren dann um deine Sammelkarte – und überbieten sich hoffentlich gegenseitig. Mechanismus Nr. 2 (Angebot): Je höher das Angebot, desto geringer ist tendenziell der Preis. Umgekehrt gilt: Je geringer das Angebot, desto höher ist tendenziell der Preis. Stell dir vor, ein Mitschüler taucht auf und besitzt gleich mehrere Exemplare deiner Sammelkarte, die er ebenfalls verkaufen möchte (höheres Angebot). Die Interessenten können sich jetzt zwischen euch und euren Angeboten entscheiden – und du musst deine Preisvorstellung vielleicht nach unten korrigieren, damit du deine Karte trotz der Konkurrenz durch deinen Mitschüler loswirst. Mechanismus Nr. 3 (Preis): Je höher der Preis, desto geringer ist die Nachfrage und desto höher das Angebot. Je geringer der Preis, desto höher ist die Nachfrage und desto geringer das Angebot. Grundsätzlich gilt: Je höher der Preis deiner Sammelkarte ist, desto weniger deiner Mitschüler*innen werden diese kaufen wollen. Gleichzeitig ist der Preis auch für die Anbieter*innen wichtig: Je teurer man die Karte verkaufen kann, desto mehr Leute sind bereit, ihre Karten anzubieten. <image>","Was ist der Hauptgrund dafür, warum ein hoher Preis für eine Sammelkarte tendenziell zu einer geringeren Nachfrage führt? <option>Weil die Leute mehr Geld haben<option>Weil sie die Karte nicht so gerne haben<option>Weil das Angebot höher wird<option>Weil die Nachfrage nach dem Geld steigt<option>Zusätzliche Option 5<option>Zusätzliche Option 6","Was ist der Hauptgrund dafür, warum ein hoher Preis für eine Sammelkarte tendenziell zu einer geringeren Nachfrage führt?

A) Weil die Leute mehr Geld haben
B) Weil sie die Karte nicht so gerne haben
C) Weil das Angebot höher wird
D) Weil die Nachfrage nach dem Geld steigt","Welches von den folgenden Szenarien zeigt, wie ein hoher Preis zu einem höheren Angebot führen kann? <option>Wenn nur eine Person für die Sammelkarte interessiert ist und sie hochpreisen möchte<option>Wenn zehn Personen für die Karte interessiert sind, aber der Verkäufer dennoch einen hohen Preis verlangt<option>Wenn ein Mitschüler taucht auf und mehrere Exemplare der Sammelkarte besitzt, um sie zu überbieten<option>Wenn niemand für die Karte interessiert ist und sie deshalb keinen Preis haben kann<option>Zusätzliche Option 5<option>Zusätzliche Option 6","Welches von den folgenden Szenarien zeigt, wie ein hoher Preis zu einem höheren Angebot führen kann?

A) Wenn nur eine Person für die Sammelkarte interessiert ist und sie hochpreisen möchte
B) Wenn zehn Personen für die Karte interessiert sind, aber der Verkäufer dennoch einen hohen Preis verlangt
C) Wenn ein Mitschüler taucht auf und mehrere Exemplare der Sammelkarte besitzt, um sie zu überbieten
D) Wenn niemand für die Karte interessiert ist und sie deshalb keinen Preis haben kann","Wie beschreibt das Preisbildungsmodell die Beziehung zwischen Preis und Angebot? <option>Je höher der Preis, desto höher das Angebot<option>Je geringer der Preis, desto höher das Angebot<option>Je höher der Preis, desto geringer das Angebot<option>Je geringer der Preis, desto geringer das Angebot<option>Zusätzliche Option 5<option>Zusätzliche Option 6","Wie beschreibt das Preisbildungsmodell die Beziehung zwischen Preis und Angebot?

A) Je höher der Preis, desto höher das Angebot
B) Je geringer der Preis, desto höher das Angebot
C) Je höher der Preis, desto geringer das Angebot
D) Je geringer der Preis, desto geringer das Angebot",Explizit,0 (Kein Bezug),Stufe 1 (Wissen/Reproduktion),multiple-choice,stammaufgabe,"Weil die Leute mehr Geld haben, Weil sie die Karte nicht so gerne haben, Weil das Angebot höher wird, Weil die Nachfrage nach dem Geld steigt, Zusätzliche Option 5, Zusätzliche Option 6, Wenn nur eine Person für die Sammelkarte interessiert ist und sie hochpreisen möchte, Wenn zehn Personen für die Karte interessiert sind, aber der Verkäufer dennoch einen hohen Preis verlangt, Wenn ein Mitschüler taucht auf und mehrere Exemplare der Sammelkarte besitzt, um sie zu überbieten, Wenn niemand für die Karte interessiert ist und sie deshalb keinen Preis haben kann, Zusätzliche Option 5, Zusätzliche Option 6, Je höher der Preis, desto höher das Angebot, Je geringer der Preis, desto höher das Angebot, Je höher der Preis, desto geringer das Angebot, Je geringer der Preis, desto geringer das Angebot, Zusätzliche Option 5, Zusätzliche Option 6",True,"[False, False, True]","[True, True, True]","[3.0, 3.4, 3.2]",Nicht vorhanden,Nicht Enthalten,Nicht Enthalten,Enthalten,Enthalten,Nicht Enthalten,Nicht Enthalten,True,True,5,True,Enthalten,Nicht Enthalten,Enthalten,Nicht Enthalten,Enthalten,Enthalten,Enthalten,Enthalten,Enthalten,Nicht Enthalten,Nicht Enthalten,Nicht Enthalten,Enthalten,Nicht Enthalten,Nicht Enthalten,Nicht Enthalten,Enthalten,Nicht Enthalten,Enthalten,Enthalten,Nicht Enthalten,Nicht Enthalten,Nicht Enthalten,Enthalten
192-sys-14,schwer,single-choice,"Preisbildungsmodell im Preismengendiagramm Wie entsteht der Milchpreis? In den letzten Abschnitten hast du bereits gelernt, dass auf Märkten Güter gehandelt werden und dabei deren Preise eine wichtige Rolle spielen. Aber wie entsteht der Preis eines Gutes jetzt genau? Schauen wir uns dafür ein ganz einfaches Beispiel an. Stellt euch vor, in der Stadt „Ökonomia“ gibt es Landwirt*innen, die Milch produzieren. Für sie gilt: Je höher der Preis pro Liter Milch, desto mehr Milch sind sie bereit zu produzieren und zu verkaufen (anzubieten): <image><image>Auf der anderen Seite gilt für die Bewohner*innen des Dorfs: Je höher der Preis pro Liter Milch, desto weniger Milch wollen sie kaufen (nachfragen): <image><image><image>Und wie entsteht jetzt der Preis? Um das zu veranschaulichen, überträgt man beide Tabellen in ein Diagramm. So ergeben sich die Angebotsgerade und die Nachfragegerade. Ein Lesebeispiel: Bei einem Preis von einem Euro würden 20 Liter angeboten (blaue Gerade) und 50 Liter nachgefragt werden (rote Gerade). Also, auf welchen Wert würde sich der Preis und die Menge anpassen? In unserem Beispiel auf zwei Euro und 40 Liter Milch. Das ist im Diagramm der Schnittpunkt von Angebots- und Nachfragegerade!  Diesen Schnittpunkt nennt man Gleichgewichtspreis. Hier halten sich Angebot und Nachfrage im Gleichgewicht: Läge der Preis oberhalb des Gleichgewichtspreis, würde mehr Milch angeboten als nachgefragt (Angebotsüberschuss). Viele Landwirt*innen würden auf der Milch sitzenbleiben. Läge der Preis unterhalb des Gleichgewichtspreises, würde mehr nachgefragt als angeboten. Viele Kund*innen würden also leer ausgehen und müssten auf Milch verzichten (Nachfrageüberschuss). ","Was passiert, wenn der Preis der Milch über dem Gleichgewichtspreis liegt? <option>Viele Landwirte produzieren mehr Milch als gefragt.<option>Die Nachfrage nach Milch ist höher als das Angebot.<option>Der Preis sinkt, um das Gleichgewicht wieder herzustellen.<option>Die Menschen haben weniger Geld für Milch.","Was passiert, wenn der Preis der Milch über dem Gleichgewichtspreis liegt?

A) Viele Landwirte produzieren mehr Milch als gefragt.
B) Die Nachfrage nach Milch ist höher als das Angebot.
C) Der Preis sinkt, um das Gleichgewicht wieder herzustellen.
D) Die Menschen haben weniger Geld für Milch.",Was ist der Gleichgewichtspreis in unserem Beispiel? <option>1 Euro<option>2 Euro<option>3 Euro<option>4 Euro,"Was ist der Gleichgewichtspreis in unserem Beispiel?

A) 1 Euro
B) 2 Euro
C) 3 Euro
D) 4 Euro","Warum liegt das Angebot an Milch über der Nachfrage, wenn der Preis unter dem Gleichgewichtspreis ist? <option>Die Menschen haben weniger Geld für Milch.<option>Viele Landwirte produzieren mehr Milch als gefragt.<option>Der Preis sinkt nicht schnell genug, um das Gleichgewicht wieder herzustellen.<option>Die Nachfrage nach Milch ist höher als das Angebot.","Warum liegt das Angebot an Milch über der Nachfrage, wenn der Preis unter dem Gleichgewichtspreis ist?

A) Die Menschen haben weniger Geld für Milch.
B) Viele Landwirte produzieren mehr Milch als gefragt.
C) Der Preis sinkt nicht schnell genug, um das Gleichgewicht wieder herzustellen.
D) Die Nachfrage nach Milch ist höher als das Angebot.",Implizit,1 (Mit Bezug),Stufe 2 (Anwendung/Transfer),single-choice,schwer,"Viele Landwirte produzieren mehr Milch als gefragt., Die Nachfrage nach Milch ist höher als das Angebot., Der Preis sinkt, um das Gleichgewicht wieder herzustellen., Die Menschen haben weniger Geld für Milch., 1 Euro, 2 Euro, 3 Euro, 4 Euro, Die Menschen haben weniger Geld für Milch., Viele Landwirte produzieren mehr Milch als gefragt., Der Preis sinkt nicht schnell genug, um das Gleichgewicht wieder herzustellen., Die Nachfrage nach Milch ist höher als das Angebot.",True,"[True, False, True]","[True, True, True]","[3.6, 3.0, 3.0]",Explizit,Enthalten,Nicht Enthalten,Enthalten,Nicht Enthalten,Enthalten,Enthalten,True,True,5,True,Nicht Enthalten,Enthalten,Enthalten,Enthalten,Enthalten,Enthalten,Nicht Enthalten,Nicht Enthalten,Nicht Enthalten,Enthalten,Nicht Enthalten,Nicht Enthalten,Nicht Enthalten,Enthalten,Nicht Enthalten,Enthalten,Enthalten,Nicht Enthalten,Nicht Enthalten,Nicht Enthalten,Enthalten,Enthalten,Nicht Enthalten,Enthalten
194-sys-15,leicht,true-false,"Verschiebungen der Nachfragegerade In unserer Stadt Ökonomia hat ein bekanntes wissenschaftliches Institut eine Studie veröffentlicht. Die Forscher*innen haben herausgefunden, dass Milch sehr gesund ist und vor Krankheiten schützt. Die Bewohner*innen Ökonomias lesen die Studie und sind begeistert. Sie wollen mehr Milch trinken und fragen somit mehr Liter Milch nach. Bei einem Preis von 0,50 € fragen sie jetzt 90l Milch nach (statt wie zuvor 70l), bei einem Preis von 1€ sind es 80l (statt wie zuvor 60l), … : <image>Wie stellt man nun diese Veränderungen in unserem Diagramm dar? Dazu tragen wir die neue Nachfrage in unser Diagramm ein: <image>Du siehst: Der Gleichgewichtspreis erhöht sich. Betrug er zuvor 2€, liegt er jetzt bei 2,50 €.  Wenn etwas passiert, das die Nachfrage zu jedem gegebenen Preis verändert, verschiebt sich die Nachfragegerade. Eine Verschiebung nach rechts zeigt einen Nachfrageanstieg an, nach links einen Nachfragerückgang. Gründe für Verschiebungen können z.B. sein, dass sich die Vorlieben der Nachfrager*innen ändern (wie beim Milch-Beispiel) oder insgesamt mehr oder weniger Einkommen haben (z. B. durch Gehaltserhöhungen oder -kürzungen).  Verschiebungen der Angebotsgerade Gute Neuigkeiten für die Milch-Landwirt*innen in Ökonomia: Durch ein vor Kurzem abgeschlossenes internationales Handelsabkommen sind die Preise für Futtermittel gefallen. Dadurch sinken die Produktionskosten und sie können bei gleichen Kosten mehr Milch anbieten. Bei einem Preis von 0,50 € bieten sie jetzt 30l an (statt wie zuvor 10l), bei einem Preis von 1 € 40l (statt wie zuvor 20l), … : <image>Im Diagramm:  <image>Du siehst: Der Gleichgewichtspreis sinkt, er beträgt jetzt wieder 2 €. Wenn etwas passiert, das das Angebot zu jedem gegebenen Preis verändert, verschiebt sich die Angebotsgerade. Eine Verschiebung nach rechts beschreibt einen Angebotsanstieg, nach links einen Angebotsrückgang. Es gibt verschiedene Gründe für Verschiebungen der Angebotsgerade, z. B. technische Innovationen, veränderte Kosten für Vorprodukte (wie beim Milch-Beispiel) oder Umwelteinflüsse (z. B. eine Dürre, die Futtermittelpreise erhöht).  ","Wie verändert sich der Gleichgewichtspreis, wenn das Angebot zu jedem gegebenen Preis steigt? <true-false>Wie verändert sich der Gleichgewichtspreis, wenn das Angebot zu jedem gegebenen Preis steigt?<true-false>Die Aussage ist falsch","Wie verändert sich der Gleichgewichtspreis, wenn das Angebot zu jedem gegebenen Preis steigt?","Wie verändert sich der Gleichgewichtspreis, wenn die Nachfrage zu jedem gegebenen Preis fällt? <true-false>Wie verändert sich der Gleichgewichtspreis, wenn die Nachfrage zu jedem gegebenen Preis fällt?<true-false>Die Aussage ist falsch","Wie verändert sich der Gleichgewichtspreis, wenn die Nachfrage zu jedem gegebenen Preis fällt?","(Keine dritte Frage generiert, da es nur zwei mögliche true-false Fragen gibt) <true-false>(Keine dritte Frage generiert, da es nur zwei mögliche true-false Fragen gibt)<true-false>Die Aussage ist falsch","(Keine dritte Frage generiert, da es nur zwei mögliche true-false Fragen gibt)",Explizit,2 (Mit Bezug),Stufe 1 (Wissen/Reproduktion),true-false,leicht,"Wie verändert sich der Gleichgewichtspreis, wenn das Angebot zu jedem gegebenen Preis steigt?, Die Aussage ist falsch, Wie verändert sich der Gleichgewichtspreis, wenn die Nachfrage zu jedem gegebenen Preis fällt?, Die Aussage ist falsch, (Keine dritte Frage generiert, da es nur zwei mögliche true-false Fragen gibt), Die Aussage ist falsch",True,"[True, True, False]","[True, True, True]","[3.2, 3.0, 3.0]",Implizit,Nicht Enthalten,Enthalten,Enthalten,Enthalten,Nicht Enthalten,Nicht Enthalten,True,True,5,True,Enthalten,Enthalten,Enthalten,Nicht Enthalten,Nicht Enthalten,Nicht Enthalten,Enthalten,Nicht Enthalten,Nicht Enthalten,Nicht Enthalten,Enthalten,Nicht Enthalten,Enthalten,Enthalten,Nicht Enthalten,Nicht Enthalten,Nicht Enthalten,Enthalten,Enthalten,Nicht Enthalten,Enthalten,Nicht Enthalten,Enthalten,Enthalten
193-sys-16,stammaufgabe,mapping,"Abgleich mit der Marktwirklichkeit Im letzten Abschnitt hast du gelernt, wie Angebot, Nachfrage und Preisbildung auf Märkten zusammenhängen. Allerdings basiert diese Erklärung von Preisbildung auf einem Modell. Du hast auch schon gelernt, dass solche Modelle die Wirklichkeit nie vollständig abbilden. Die Annahmen aus Modellen vereinfachen die Realität und ermöglichen uns, dass wir komplizierte Zusammenhänge besser verstehen und die wesentlichen Eigenschaften hervorheben können. Sie helfen uns also beim Erklären von Problemen, Sachverhalten und Erkenntnissen aus der Wirklichkeit. Wenn wir vom Preisbildungsmodell sprechen, werden dort fünf Annahmen getroffen: Es gibt auf diesem Markt viele Anbieter und viele Nachfrager. Kein Anbieter oder Nachfrager beherrscht den Markt allein.  Die Nachfrager wollen zu einem günstigen Preis kaufen, die Anbieter möglichst teuer verkaufen. Die Anbieter und Nachfrager wissen genau, zu welchen Preisen Produkte auf einem Markt angeboten werden. Mit anderen Worten: Sie haben vollständige Markttransparenz.  Die Produkte auf dem Markt haben alle die gleiche Qualität. Entscheidend für Anbieter und Nachfrager ist allein der Preis. Die Nachfrager und Anbieter bevorzugen – z. B. aus Gründen der Freundschaft oder der räumlichen Nähe - keinen der Marktteilnehmer.  Wichtig ist: Trifft nur eine dieser Annahmen des Preisbildungsmodells nicht zu, dann haben auch andere Faktoren einen Einfluss auf das Zusammenspiel von Angebot und Nachfrage. Es zeigt sich also eine Grenze des Modells. Diese Grenzen von Modellen lassen sich an einem konkreten Beispiel besser erklären:  Beim Sammelkarten-Beispiel von oben sind die Bedingungen Nummer 2 und 5 nicht erfüllt. <image>Denke noch einmal an das Beispiel mit der Sammelkarte und wie sich der Preis aufgrund von Nachfrage und Angebot entwickelt hat. Bisher haben wir angenommen, dass du deine seltene Sammelkarte möglichst teuer verkaufen wolltest. Stell dir nun aber vor, dass auch dein bester Freund Interesse an der Sammelkarte hat. Vermutlich verkaufst du die Sammelkarte dann lieber an deinen Freund und bist vielleicht sogar damit zufrieden, wenn er dir ein bisschen weniger bezahlt.  Du siehst: Manchmal bestimmen nicht allein die Angebotsmenge und die Nachfrage den Preis. Hier wird deutlich, dass du deinen Freund anderen Marktteilnehmern gegenüber bevorzugst. In der Realität kannst du aber auch sehen, dass Faktoren wie die Qualität von Gütern und Dienstleistungen oder die zur Verfügung stehenden Informationen einen Einfluss auf den Preis haben können. ","Welche Bedingung ist nicht erfüllt, wenn man das Beispiel mit der Sammelkarte betrachtet?  <start-option>Bedürfnisse<start-option>Nachfrage<start-option>Angebot<start-option>Markt<end-option>Wünsche von Menschen<end-option>Was Kunden kaufen wollen<end-option>Was Unternehmen anbieten<end-option>Ort des Tauschens","Welche Bedingung ist nicht erfüllt, wenn man das Beispiel mit der Sammelkarte betrachtet? 
<start-option> Der Markt hat viele Anbieter und Nachfrager. </start-option>
<end-option> Die Nachfrager und Anbieter bevorzugen keinen der Marktteilnehmer aufgrund von Freundschaft oder räumlicher Nähe. </end-option>","Welche Bedingung ist nicht erfüllt, wenn man das Beispiel mit der Sammelkarte betrachtet?  <start-option>Bedürfnisse<start-option>Nachfrage<start-option>Angebot<start-option>Markt<end-option>Wünsche von Menschen<end-option>Was Kunden kaufen wollen<end-option>Was Unternehmen anbieten<end-option>Ort des Tauschens","Welche Bedingung ist nicht erfüllt, wenn man das Beispiel mit der Sammelkarte betrachtet? 
<start-option> Die Nachfrager und Anbieter wissen genau zu welchen Preisen Produkte auf einem Markt angeboten werden. </start-option>
<end-option> Die Produkte haben alle die gleiche Qualität. </end-option>","Welche Bedingung ist nicht erfüllt, wenn man das Beispiel mit der Sammelkarte betrachtet?  <start-option>Bedürfnisse<start-option>Nachfrage<start-option>Angebot<start-option>Markt<end-option>Wünsche von Menschen<end-option>Was Kunden kaufen wollen<end-option>Was Unternehmen anbieten<end-option>Ort des Tauschens","Welche Bedingung ist nicht erfüllt, wenn man das Beispiel mit der Sammelkarte betrachtet? 
<start-option> Es gibt auf diesem Markt viele Anbieter und Nachfrager. </start-option>
<end-option> Die Nachfrager wollen zu einem günstigen Preis kaufen, die Anbieter möglichst teuer verkaufen. </end-option>",Implizit,0 (Kein Bezug),Stufe 2 (Anwendung/Transfer),mapping,stammaufgabe,"Bedürfnisse, Nachfrage, Angebot, Markt, Wünsche von Menschen, Was Kunden kaufen wollen, Was Unternehmen anbieten, Ort des Tauschens, Bedürfnisse, Nachfrage, Angebot, Markt, Wünsche von Menschen, Was Kunden kaufen wollen, Was Unternehmen anbieten, Ort des Tauschens, Bedürfnisse, Nachfrage, Angebot, Markt, Wünsche von Menschen, Was Kunden kaufen wollen, Was Unternehmen anbieten, Ort des Tauschens",True,"[True, True, True]","[True, True, True]","[3.0, 3.0, 3.0]",Nicht vorhanden,Enthalten,Enthalten,Enthalten,Nicht Enthalten,Enthalten,Enthalten,True,True,5,True,Nicht Enthalten,Nicht Enthalten,Nicht Enthalten,Enthalten,Nicht Enthalten,Nicht Enthalten,Nicht Enthalten,Enthalten,Nicht Enthalten,Enthalten,Enthalten,Nicht Enthalten,Nicht Enthalten,Nicht Enthalten,Enthalten,Enthalten,Nicht Enthalten,Enthalten,Nicht Enthalten,Enthalten,Enthalten,Enthalten,Enthalten,Enthalten
