184-sys-4,stammaufgabe,mapping,"Güter dienen der Bedürfnisbefriedigung Tom hat Hunger. Er möchte sich einen Apfel kaufen, um seinen Hunger zu stillen. Du hast bereits gelernt, dass sich hinter diesem alltäglichen Vorgang in der Wirtschaftslehre ganz bestimmte Begriffe „verstecken“: Toms Wunsch, etwas zu essen, bezeichnet man als Bedürfnis. Das konkrete Verlangen nach einem Apfel als Bedarf. Jetzt kommt noch ein neues Wort dazu: Den Apfel selbst bezeichnet man in der Wirtschaftslehre als ein Gut. Güter sind Dinge oder Tätigkeiten, die der Bedürfnisbefriedigung dienen. Der Apfel ist z.B. ein Gut, da er dazu dient, Toms Bedürfnis etwas zu essen zu befriedigen. Schau dich in diesem Moment mal um, du bist ständig von Gütern umgeben: Die Kleidung, die du trägst, ist ein Gut (befriedigt das Bedürfnis nach Wärme). Das Handy, das du vielleicht in deiner Hosentasche hast, ist ein Gut (befriedigt sehr viele Bedürfnisse, z.B. das nach Unterhaltung) und auch das Wasser, das du vielleicht gerade trinken wolltest, ist ein Gut (befriedigt deinen Durst). Vorsicht! Nicht nur Dinge, die man anfassen kann, sind Güter. Im Kasten heißt es ja “Güter sind Dinge oder Tätigkeiten, die der Bedürfnisbefriedigung dienen”. Auch Tätigkeiten, die man für andere erbringt und Bedürfnisse befriedigen, bezeichnet man als Gut (z.B. ein Friseurbesuch oder eine Autoreparatur). Solche Güter nennt man Dienstleistungen. Güter, die man anfassen kann, nennt man Sachgüter.  ",Ordne die Begriffe den richtigen Erklärungen zu. <start-option>Bedürfnisse<start-option>Nachfrage<start-option>Angebot<start-option>Markt<end-option>Wünsche von Menschen<end-option>Was Kunden kaufen wollen<end-option>Was Unternehmen anbieten<end-option>Ort des Tauschens,"Was ist ein Beispiel für eine Tätigkeit, die als Dienstleistung gilt?",Ordne die Begriffe den richtigen Erklärungen zu. <start-option>Bedürfnisse<start-option>Nachfrage<start-option>Angebot<start-option>Markt<end-option>Wünsche von Menschen<end-option>Was Kunden kaufen wollen<end-option>Was Unternehmen anbieten<end-option>Ort des Tauschens,Welche Art von Gut bezeichnet man als Sachgut?,Ordne die Begriffe den richtigen Erklärungen zu. <start-option>Bedürfnisse<start-option>Nachfrage<start-option>Angebot<start-option>Markt<end-option>Wünsche von Menschen<end-option>Was Kunden kaufen wollen<end-option>Was Unternehmen anbieten<end-option>Ort des Tauschens,In welchem Szenario wäre ein Besuch eines Friseurs ein gut?,Implizit,0 (Kein Bezug),Stufe 2 (Anwendung/Transfer),mapping,stammaufgabe,"Bedürfnisse, Nachfrage, Angebot, Markt, Wünsche von Menschen, Was Kunden kaufen wollen, Was Unternehmen anbieten, Ort des Tauschens, Bedürfnisse, Nachfrage, Angebot, Markt, Wünsche von Menschen, Was Kunden kaufen wollen, Was Unternehmen anbieten, Ort des Tauschens, Bedürfnisse, Nachfrage, Angebot, Markt, Wünsche von Menschen, Was Kunden kaufen wollen, Was Unternehmen anbieten, Ort des Tauschens",True,"[False, False, False]","[True, True, True]","[3.0, 3.0, 3.0]",Nicht vorhanden,Enthalten,Enthalten,Nicht Enthalten,Nicht Enthalten,Enthalten,Enthalten,True,True,5,True,Nicht Enthalten,Nicht Enthalten,Enthalten,Enthalten,Nicht Enthalten,Enthalten,Nicht Enthalten,Enthalten,Enthalten,Enthalten,Enthalten,Enthalten,Nicht Enthalten,Nicht Enthalten,Nicht Enthalten,Enthalten,Nicht Enthalten,Nicht Enthalten,Nicht Enthalten,Enthalten,Nicht Enthalten,Enthalten,Enthalten,Nicht Enthalten
187-sys-5,schwer,multiple-choice,"Knappheit Einige Güter kann man haben, ohne dafür bezahlen zu müssen. Denk z.B. an die Luft zum Atmen: Da diese Güter niemandem gehören, können sie unbegrenzt und ohne Bezahlung genutzt werden. Solche Güter nennt man freie Güter. Je knapper ein Gut ist, desto höher ist i.d.R. sein Preis. Freie Güter zeichnen sich dadurch aus, dass sie kostenlos sind. Leider trifft dies nur auf sehr wenige Güter zu. Von den meisten Gütern gibt es nicht so viel, dass jeder Mensch einfach so viel davon haben kann, wie er will. Solche Güter nennt man knappe Güter. Knappheit liegt also dann vor, wenn ein Gut nur in einer geringeren Menge als gewünscht vorhanden ist. Es gibt dabei jedoch zwei Arten von Knappheit, bei denen genauer betrachtet wird, warum einige Menschen nicht so viel von einem Gut haben können, wie sie wollen: Absolute Knappheit liegt dann vor, wenn ein Gut zu einer bestimmten Zeit und an einem bestimmten Ort nicht oder nur in sehr begrenzter Menge vorhanden ist, z.B. Wasser in der Wüste. Für Relative Knappheit ist die Menge, in der ein Gut vorhanden ist, zweitrangig. Relative Knappheit kann auch vorliegen, wenn es sehr viel von einem Gut gibt. Entscheidend ist allein, dass die Mittel der Menschen nicht ausreichen und sie somit nicht so viel von einem Gut haben können, wie sie wollen. ",Was ist ein Merkmal von freien Gütern? <option>Sie sind nur für eine begrenzte Zeit verfügbar.<option>Sie können kostenlos genutzt werden.<option>Sie sind immer knapp.<option>Sie müssen bezahlt werden.<option>Zusätzliche Option 5<option>Zusätzliche Option 6,"Was ist ein Merkmal von freien Gütern?

A) Sie sind nur für eine begrenzte Zeit verfügbar.
B) Sie können kostenlos genutzt werden.
C) Sie sind immer knapp.
D) Sie müssen bezahlt werden.","Welche Art der Knappheit liegt vor, wenn die Menge eines Gutes zwar vorhanden ist, aber die Mittel der Menschen nicht ausreichen, um es so viel zu haben, wie sie wollen? <option>Absolute Knappheit<option>Relative Knappheit<option>Keine Knappheit<option>Unbekannt<option>Zusätzliche Option 5<option>Zusätzliche Option 6","Welche Art der Knappheit liegt vor, wenn die Menge eines Gutes zwar vorhanden ist, aber die Mittel der Menschen nicht ausreichen, um es so viel zu haben, wie sie wollen?

A) Absolute Knappheit
B) Relative Knappheit
C) Keine Knappheit
D) Unbekannt",Welche Art der Knappheit bezieht sich auf die Verfügbarkeit eines Gutes an einem bestimmten Ort und zu einer bestimmten Zeit? <option>Absolute Knappheit<option>Relative Knappheit<option>Keine Knappheit<option>Unbekannt<option>Zusätzliche Option 5<option>Zusätzliche Option 6,"Welche Art der Knappheit bezieht sich auf die Verfügbarkeit eines Gutes an einem bestimmten Ort und zu einer bestimmten Zeit?

A) Absolute Knappheit
B) Relative Knappheit
C) Keine Knappheit
D) Unbekannt",Explizit,1 (Mit Bezug),Stufe 1 (Wissen/Reproduktion),multiple-choice,schwer,"Sie sind nur für eine begrenzte Zeit verfügbar., Sie können kostenlos genutzt werden., Sie sind immer knapp., Sie müssen bezahlt werden., Zusätzliche Option 5, Zusätzliche Option 6, Absolute Knappheit, Relative Knappheit, Keine Knappheit, Unbekannt, Zusätzliche Option 5, Zusätzliche Option 6, Absolute Knappheit, Relative Knappheit, Keine Knappheit, Unbekannt, Zusätzliche Option 5, Zusätzliche Option 6",True,"[True, False, False]","[True, True, True]","[3.2, 3.6, 3.2]",Explizit,Nicht Enthalten,Nicht Enthalten,Enthalten,Enthalten,Nicht Enthalten,Nicht Enthalten,True,True,5,True,Enthalten,Nicht Enthalten,Enthalten,Nicht Enthalten,Enthalten,Enthalten,Enthalten,Enthalten,Enthalten,Nicht Enthalten,Nicht Enthalten,Nicht Enthalten,Enthalten,Nicht Enthalten,Nicht Enthalten,Nicht Enthalten,Enthalten,Nicht Enthalten,Enthalten,Enthalten,Nicht Enthalten,Nicht Enthalten,Nicht Enthalten,Enthalten
185-sys-6,leicht,single-choice,"Minimal- und Maximalprinzip Wir können nicht zu jeder Zeit alles haben, was wir wollen. Die allgegenwärtige Knappheit – unbegrenzte Bedürfnisse auf der einen Seite, begrenzte Mittel zu deren Befriedigung auf der anderen Seite – erfordert, dass wir uns für bestimmte Handlungsalternativen entscheiden: Manchmal muss man sich entscheiden, ob man Freitagabend mit Freunden ins Kino geht oder jobbt. Für beides gleichzeitig hat man keine Zeit.  Manchmal muss man sich entschieden, ob man sich von seinem Taschengeld eine neue Jacke oder neue Schuhe kauft. Für beides zusammen hat man vielleicht nicht genug Geld.  Jede Entscheidung ist mit Kosten und Nutzen verbunden. Wenn du Freitagabends ins Kino gehst, entstehen für dich z.B. die Kosten für das Kinoticket. Der Nutzen des Kinobesuchs ist z.B., dass du Spaß hast und unterhalten wirst.  Unsere Entscheidungen orientieren sich in der Regel an zwei grundlegenden ökonomischen Prinzipien: Maximalprinzip: Wir versuchen, mit den gegebenen Mitteln (Geld, Zeit, …) größtmöglichen Nutzen zu erzielen.  Minimalprinzip: Wir versuchen, ein bestimmtes Ziel mit einem möglichst geringen Einsatz an Mitteln zu erreichen Willst du wissen, ob eine Handlung dem Minimal- oder Maximalprinzip folgt? Frag dich zuerst: Was ist gegeben, das Ziel (→ Minimalprinzip) oder die Mittel (→ Maximalprinzip)? ","Was ist gegeben, wenn du Freitagabends ins Kino gehst? <option>Das Ziel ist gegeben<option>Die Mittel sind gegeben<option>Beides ist gegeben<option>Option 4","Was ist gegeben, wenn du Freitagabends ins Kino gehst? 
A) Das Ziel ist gegeben
B) Die Mittel sind gegeben
C) Beides ist gegeben","Willst du wissen, ob eine Handlung dem Minimal- oder Maximalprinzip folgt? Frag dich zuerst: <option>Was ist dein Ziel?<option>Welche Mittel hast du?<option>Beides ist irrelevant<option>Option 4","Willst du wissen, ob eine Handlung dem Minimal- oder Maximalprinzip folgt? Frag dich zuerst:
A) Was ist dein Ziel?
B) Welche Mittel hast du?
C) Beides ist irrelevant","Was ist das Ziel, wenn wir versuchen, ein bestimmtes Ziel mit einem möglichst geringen Einsatz an Mitteln zu erreichen? <option>Wir wollen ein Maximum erzielen<option>Wir wollen ein Minimum erzielen<option>Es ist egal<option>Option 4","Was ist das Ziel, wenn wir versuchen, ein bestimmtes Ziel mit einem möglichst geringen Einsatz an Mitteln zu erreichen?
A) Wir wollen ein Maximum erzielen
B) Wir wollen ein Minimum erzielen
C) Es ist egal",Implizit,2 (Mit Bezug),Stufe 2 (Anwendung/Transfer),single-choice,leicht,"Das Ziel ist gegeben, Die Mittel sind gegeben, Beides ist gegeben, Option 4, Was ist dein Ziel?, Welche Mittel hast du?, Beides ist irrelevant, Option 4, Wir wollen ein Maximum erzielen, Wir wollen ein Minimum erzielen, Es ist egal, Option 4",True,"[False, False, False]","[True, True, True]","[3.6, 2.8, 3.4]",Implizit,Enthalten,Nicht Enthalten,Enthalten,Nicht Enthalten,Enthalten,Enthalten,True,True,5,True,Nicht Enthalten,Enthalten,Enthalten,Enthalten,Enthalten,Enthalten,Nicht Enthalten,Nicht Enthalten,Nicht Enthalten,Enthalten,Nicht Enthalten,Nicht Enthalten,Nicht Enthalten,Enthalten,Nicht Enthalten,Enthalten,Enthalten,Nicht Enthalten,Nicht Enthalten,Nicht Enthalten,Enthalten,Enthalten,Nicht Enthalten,Enthalten
186-sys-7,stammaufgabe,true-false,"Opportunitätskosten  Entscheidest du dich dafür, Freitagabend ins Kino zu gehen, statt zu jobben, dann entstehen dir nicht nur die Kosten für das Kinoticket. Du verzichtest auch auf das Gehalt, dass du hättest verdienen können, wenn du jobben gegangen wärst.  Das, worauf man verzichtet, wenn man sich für eine Handlungsalternative entscheidet, nennt man Opportunitätskosten (auch: Verzichtskosten). Kosten und Nutzen beziehen sich nicht allein auf Geld. Der Nutzen einer Handlung kann z.B. auch Spaß oder Erholung sein. Die Kosten einer Handlung umfassen z.B. auch die Zeit, die du brauchst, um die Handlung durchzuführen oder Güter, die für die Durchführung der Handlung benötigt werden. ",Was sind Opportunitätskosten? <true-false>Was sind Opportunitätskosten?<true-false>Die Aussage ist falsch,Was sind Opportunitätskosten?,Wann entstehen Opportunitätskosten? <true-false>Wann entstehen Opportunitätskosten?<true-false>Die Aussage ist falsch,Wann entstehen Opportunitätskosten?,Wie können Kosten und Nutzen sich auf ein Ziel auswirken? <true-false>Wie können Kosten und Nutzen sich auf ein Ziel auswirken?<true-false>Die Aussage ist falsch,Wie können Kosten und Nutzen sich auf ein Ziel auswirken?,Explizit,0 (Kein Bezug),Stufe 1 (Wissen/Reproduktion),true-false,stammaufgabe,"Was sind Opportunitätskosten?, Die Aussage ist falsch, Wann entstehen Opportunitätskosten?, Die Aussage ist falsch, Wie können Kosten und Nutzen sich auf ein Ziel auswirken?, Die Aussage ist falsch",True,"[True, False, False]","[True, True, True]","[3.4, 3.0, 2.8]",Nicht vorhanden,Nicht Enthalten,Enthalten,Enthalten,Enthalten,Nicht Enthalten,Nicht Enthalten,True,True,5,True,Enthalten,Enthalten,Enthalten,Nicht Enthalten,Nicht Enthalten,Nicht Enthalten,Enthalten,Nicht Enthalten,Nicht Enthalten,Nicht Enthalten,Enthalten,Nicht Enthalten,Enthalten,Enthalten,Nicht Enthalten,Nicht Enthalten,Nicht Enthalten,Enthalten,Enthalten,Nicht Enthalten,Enthalten,Nicht Enthalten,Enthalten,Enthalten
189-sys-8,schwer,mapping,"Verteilungsmechanismus ohne Markt Die Mitglieder der Band „Economics“, kommen für ein Konzert in ihre Heimatstadt. Sie treten in dem kleinen Club auf, in dem sie ihr erstes Konzert gegeben haben. Allerdings ist hier nur Platz für 300 Menschen. Da nicht genug Plätze für alle da sind, muss die Band entscheiden, wer eines der Tickets bekommt. Hierfür gibt es verschiedene Ansätze: <image>Zuteilung: Die Band könnte die Konzertkarten einfach an die alten Bekannten verteilen. Oder sie verteilt die Tickets an die ältesten Interessenten. Wenn knappe Güter von jemandem aufgrund festgelegter Kriterien verteilt werden, spricht man vom Verteilungsmechanismus der Zuteilung.  <image>Windhund-Verfahren: Natürlich könnte die Band die Tickets auch an die Personen verteilen, die sie als erstes um eines bitten. Nach dem Motto: Wer zuerst kommt – mahlt zuerst. Dieser Verteilungsmechanismus, bei dem diejenigen die Güter bekommen, die zuerst nach ihnen verlangen, wird als Windhund-Verfahren bezeichnet. <image>Verlosung: Alternativ könnten sie auch den Zufall entscheiden lassen. Zum Beispiel könnten die „Economics“ Lose verteilen und die Gewinner bekämen eines der Tickets. Dieser Verteilungsmechanismus, der auf Zufall basiert, wird Verlosung genannt. ",Ordne die Begriffe den richtigen Erklärungen zu. <start-option>Bedürfnisse<start-option>Nachfrage<start-option>Angebot<start-option>Markt<end-option>Wünsche von Menschen<end-option>Was Kunden kaufen wollen<end-option>Was Unternehmen anbieten<end-option>Ort des Tauschens,"Wer erhält eines der Tickets? <start-option>Die Mitglieder der Band</start-option><end-option>Die alten Bekannten</end-option><start-option>Die ältesten Interessenten</start-option><end-option>Der erste, der um ein Ticket bittet</end-option>",Ordne die Begriffe den richtigen Erklärungen zu. <start-option>Bedürfnisse<start-option>Nachfrage<start-option>Angebot<start-option>Markt<end-option>Wünsche von Menschen<end-option>Was Kunden kaufen wollen<end-option>Was Unternehmen anbieten<end-option>Ort des Tauschens,"Wer erhält eines der Tickets? <start-option>Die Mitglieder der Band</start-option><end-option>Die alten Bekannten</end-option><start-option>Der erste, der um ein Ticket bittet</end-option><end-option>Ein Gewinner aus einer Verlosung</end-option>",Ordne die Begriffe den richtigen Erklärungen zu. <start-option>Bedürfnisse<start-option>Nachfrage<start-option>Angebot<start-option>Markt<end-option>Wünsche von Menschen<end-option>Was Kunden kaufen wollen<end-option>Was Unternehmen anbieten<end-option>Ort des Tauschens,"Wer erhält eines der Tickets? <start-option>Der erste, der um ein Ticket bittet</start-option><end-option>Ein Gewinner aus einer Verlosung</end-option><start-option>Die alten Bekannten</start-option><end-option>Die Mitglieder der Band</end-option>",Implizit,1 (Mit Bezug),Stufe 2 (Anwendung/Transfer),mapping,schwer,"Bedürfnisse, Nachfrage, Angebot, Markt, Wünsche von Menschen, Was Kunden kaufen wollen, Was Unternehmen anbieten, Ort des Tauschens, Bedürfnisse, Nachfrage, Angebot, Markt, Wünsche von Menschen, Was Kunden kaufen wollen, Was Unternehmen anbieten, Ort des Tauschens, Bedürfnisse, Nachfrage, Angebot, Markt, Wünsche von Menschen, Was Kunden kaufen wollen, Was Unternehmen anbieten, Ort des Tauschens",True,"[False, False, False]","[True, True, True]","[3.2, 3.2, 3.2]",Explizit,Enthalten,Enthalten,Enthalten,Nicht Enthalten,Enthalten,Enthalten,True,True,5,True,Nicht Enthalten,Nicht Enthalten,Nicht Enthalten,Enthalten,Nicht Enthalten,Nicht Enthalten,Nicht Enthalten,Enthalten,Nicht Enthalten,Enthalten,Enthalten,Nicht Enthalten,Nicht Enthalten,Nicht Enthalten,Enthalten,Enthalten,Nicht Enthalten,Enthalten,Nicht Enthalten,Enthalten,Enthalten,Enthalten,Enthalten,Enthalten
195-sys-9,leicht,multiple-choice,"Verteilungsmechanismen mit Markt Die Mitglieder der Band „Economics“, kommen für ein Konzert in ihre Heimatstadt. Sie treten in dem kleinen Club auf, in dem sie ihr erstes Konzert gegeben haben. Allerdings ist hier nur Platz für 300 Menschen. Da nicht genug Plätze für alle da sind, muss die Band entscheiden, wer eines der Tickets bekommt. Hierfür haben wir dir bereits einige Ansätze vorgestellt (Zuteilung, Windhund-Verfahren und Verlosung). Hinzu kommt nun der Markt: <image>Die Band könnte sich aber auch dazu entscheiden die Konzertkarten zum Verkauf anzubieten. So bekommen nur diejenigen eine Karte, die das Konzert auch gerne besuchen möchten. Denn nur wer bereit ist Geld für ein Ticket zu bezahlen wird auch eines bekommen können. Verkaufen die „Economics“ die Konzertkarten zu einem Preis von 15 Euro wird es einige Menschen geben, die nicht bereit sind, diesen Preis zu bezahlen, um das Konzert zu sehen. Andere hingegen, die vielleicht sogar richtige Fans sind, bezahlen die 15 Euro gerne, um die Band Live zu sehen. Der Preis, den jemand bereit ist zu bezahlen, zeigt an, wie dringend jemand etwas haben möchte. Im Nachbarort hat man mitbekommen, wie gut die Verteilung der Konzertkarten über den Markt funktioniert und versucht das gleiche mit den Karten für das Puppentheater. Leider haben viele der Anwohner kein Interesse an dem Puppentheater und sind nicht bereit den Preis von 15 Euro für ein Ticket zu bezahlen. Der Nachbarort bleibt auf den Eintrittskarten sitzen und wird beim nächsten Mal eher auch ein Konzert veranstalten. Märkte sorgen also nicht nur dafür, dass diejenigen die Güter bekommen, die sie am dringendsten haben möchten, sondern auch dafür, dass tendenziell nur solche Güter hergestellt und verkauft werden, die die Menschen auch haben wollen. Knappe Güter werden in der Regel über Märkte verteilt. In manchen Fällen werden aber auch verschiedene Verteilungsmechanismen kombiniert. Häufig ist das bei Konzertkarten der Fall. Diese werden zwar zu bestimmten Preisen verkauft (Handel auf einem Markt) und trotzdem ist es oft so, dass nur diejenigen, die auch schnell genug sind, eine Karte kaufen können (Windhund-Verfahren). Der Verteilungsmechanismus Markt ist im Grunde ein Tausch. Man könnte eigentlich mit allem tauschen, aber in der Regel tauschen wir mit Geld. Das vereinfacht das Wirtschaftsleben erheblich, weil es den Wert von Gütern über eine Recheneinheit vergleichbar macht. Ohne Geld müssten die einzelnen Tauschverhältnisse untereinander bestimmt werden: Eier in Äpfel, Eier in Salz, Salz in Kleidung. Dank des Geldes hat man ein einheitliches Tauschmittel. So können auch sehr unterschiedliche Dinge miteinander verglichen werden. ","Wer erhält ein Konzertticket, wenn es über den Markt verkauft wird? <option>Nur wer das Konzert gerne sehen möchte<option>Jeder, der ein Ticket kaufen kann<option>Derjenige, der das teuerste Angebot gibt<option>Keiner, weil die Tickets nicht verkauft werden<option>Zusätzliche Option 5<option>Zusätzliche Option 6","Wer erhält ein Konzertticket, wenn es über den Markt verkauft wird?

A) Nur wer das Konzert gerne sehen möchte
B) Jeder, der ein Ticket kaufen kann
C) Derjenige, der das teuerste Angebot gibt
D) Keiner, weil die Tickets nicht verkauft werden","Welchen Effekt hat der Markt auf den Warenbestand? <option>Er erhöht ihn<option>Er senkt ihn<option>Er sorgt dafür, dass nur diejenigen Güter hergestellt und verkauft werden, die die Menschen wollen<option>Er sorgt dafür, dass alle Güter verkaufbar sind<option>Zusätzliche Option 5<option>Zusätzliche Option 6","Welchen Effekt hat der Markt auf den Warenbestand?

A) Er erhöht ihn
B) Er senkt ihn
C) Er sorgt dafür, dass nur diejenigen Güter hergestellt und verkauft werden, die die Menschen wollen
D) Er sorgt dafür, dass alle Güter verkaufbar sind",Was ist das einheitliche Tauschmittel im Wirtschaftsleben? <option>Geld<option>Zeit<option>Arbeit<option>Energie<option>Zusätzliche Option 5<option>Zusätzliche Option 6,"Was ist das einheitliche Tauschmittel im Wirtschaftsleben?

A) Geld
B) Zeit
C) Arbeit
D) Energie",Explizit,2 (Mit Bezug),Stufe 1 (Wissen/Reproduktion),multiple-choice,leicht,"Nur wer das Konzert gerne sehen möchte, Jeder, der ein Ticket kaufen kann, Derjenige, der das teuerste Angebot gibt, Keiner, weil die Tickets nicht verkauft werden, Zusätzliche Option 5, Zusätzliche Option 6, Er erhöht ihn, Er senkt ihn, Er sorgt dafür, dass nur diejenigen Güter hergestellt und verkauft werden, die die Menschen wollen, Er sorgt dafür, dass alle Güter verkaufbar sind, Zusätzliche Option 5, Zusätzliche Option 6, Geld, Zeit, Arbeit, Energie, Zusätzliche Option 5, Zusätzliche Option 6",True,"[True, False, False]","[True, True, True]","[3.6, 3.2, 3.8]",Implizit,Nicht Enthalten,Nicht Enthalten,Nicht Enthalten,Enthalten,Nicht Enthalten,Nicht Enthalten,True,True,5,True,Enthalten,Nicht Enthalten,Nicht Enthalten,Nicht Enthalten,Enthalten,Nicht Enthalten,Enthalten,Enthalten,Nicht Enthalten,Nicht Enthalten,Nicht Enthalten,Enthalten,Enthalten,Nicht Enthalten,Enthalten,Nicht Enthalten,Enthalten,Enthalten,Enthalten,Enthalten,Enthalten,Nicht Enthalten,Nicht Enthalten,Nicht Enthalten
188-sys-10,stammaufgabe,single-choice,"Anbieter und Nachfrager auf Märkten Märkte sind Treffpunkte von Angebot und Nachfrage. Bei uns werden die meisten Güter über Märkte verteilt. Doch was genau ist so ein Markt? Die Nachfrage ist die Menge an Gütern, die Nachfrager und Nachfragerinnen auf Märkten kaufen wollen. Erinnerst du dich an das Konzertkarten-Beispiel? Hier sind die Fans die Nachfragerinnen und Nachfrager, denn sie wollen eine der Konzertkarten kaufen. Das Ziel der Nachfragerinnen und Nachfrager ist es, die Güter, die sie zur Befriedigung ihrer Bedürfnisse benötigen, zu möglichst niedrigen Preisen einzukaufen. Alltagssprache vs. Fachsprache: In der Alltagssprache sprechen wir auch von einer Nachfrage, wenn man etwas nicht verstanden hat. In der Fachsprache der Wirtschaft ist die Nachfrage die Menge an Gütern, die Käuferinnen und Käufer auf Märkten erwerben wollen. Das Angebot ist die Summe aller angebotenen Güter auf einem Markt. In dem Konzertkarten-Beispiel sind die Tickets, die die zum Verkauf stehen, das Angebot. In diesem Beispiel ist also der Konzertveranstalter der Anbieter. Anbieter wollen ihre Sachgüter oder Dienstleistungen auf Märkten verkaufen oder tauschen. Dabei ist ihr Ziel einen möglichst hohen Preis zu erzielen.  ","Was genau ist die Nachfrage in der Wirtschaft? <option>Die Menge an Gütern, die Anbieter auf Märkten verkaufen wollen<option>Die Summe aller angebotenen Güter auf einem Markt<option>Die Menge an Gütern, die Käuferinnen und Käufer auf Märkten erwerben wollen<option>Das Angebot","Was genau ist die Nachfrage in der Wirtschaft?

A) Die Menge an Gütern, die Anbieter auf Märkten verkaufen wollen
B) Die Summe aller angebotenen Güter auf einem Markt
C) Die Menge an Gütern, die Käuferinnen und Käufer auf Märkten erwerben wollen
D) Das Angebot",Was ist das Ziel der Anbieter? <option>Einen möglichst niedrigen Preis zu erzielen<option>Ein bestimmtes Produkt zu verkaufen<option>Die Nachfrage zu maximieren<option>Einen möglichst hohen Preis zu erzielen,"Was ist das Ziel der Anbieter?

A) Einen möglichst niedrigen Preis zu erzielen
B) Ein bestimmtes Produkt zu verkaufen
C) Die Nachfrage zu maximieren
D) Einen möglichst hohen Preis zu erzielen","Was ist ein Markt? <option>Ein Ort, an dem Güter gekauft und verkauft werden<option>Ein Ort, an dem Anbieter ihre Sachgüter oder Dienstleistungen verkaufen wollen<option>Ein Ort, an dem die Nachfrage maximiert wird<option>Ein Ort, an dem der Preis niedrig ist","Was ist ein Markt?

A) Ein Ort, an dem Güter gekauft und verkauft werden
B) Ein Ort, an dem Anbieter ihre Sachgüter oder Dienstleistungen verkaufen wollen
C) Ein Ort, an dem die Nachfrage maximiert wird
D) Ein Ort, an dem der Preis niedrig ist",Implizit,0 (Kein Bezug),Stufe 2 (Anwendung/Transfer),single-choice,stammaufgabe,"Die Menge an Gütern, die Anbieter auf Märkten verkaufen wollen, Die Summe aller angebotenen Güter auf einem Markt, Die Menge an Gütern, die Käuferinnen und Käufer auf Märkten erwerben wollen, Das Angebot, Einen möglichst niedrigen Preis zu erzielen, Ein bestimmtes Produkt zu verkaufen, Die Nachfrage zu maximieren, Einen möglichst hohen Preis zu erzielen, Ein Ort, an dem Güter gekauft und verkauft werden, Ein Ort, an dem Anbieter ihre Sachgüter oder Dienstleistungen verkaufen wollen, Ein Ort, an dem die Nachfrage maximiert wird, Ein Ort, an dem der Preis niedrig ist",True,"[False, False, False]","[True, True, True]","[3.2, 3.2, 3.0]",Nicht vorhanden,Enthalten,Nicht Enthalten,Nicht Enthalten,Nicht Enthalten,Enthalten,Enthalten,True,True,5,True,Nicht Enthalten,Enthalten,Nicht Enthalten,Enthalten,Enthalten,Nicht Enthalten,Nicht Enthalten,Nicht Enthalten,Enthalten,Enthalten,Nicht Enthalten,Enthalten,Nicht Enthalten,Enthalten,Enthalten,Enthalten,Enthalten,Enthalten,Nicht Enthalten,Nicht Enthalten,Nicht Enthalten,Enthalten,Nicht Enthalten,Nicht Enthalten
