c_id,subject,type,text,question_1,initial_question_1,question_2,initial_question_2,question_3,initial_question_3,p.instruction_explicitness_of_instruction,p.mathematical_requirement_level,p.taxanomy_level,question_type,p.variation,answers,typed_pipeline_used,refinement_applied,format_preserved,expert_average_ratings,p.root_text_reference_explanatory_text,p.root_text_obstacle_passive,p.root_text_obstacle_negation,p.root_text_obstacle_complex_np,p.root_text_contains_irrelevant_information,p.instruction_obstacle_passive,p.instruction_obstacle_complex_np,dspy_consensus_used,dspy_modular_prompts,dspy_expert_count,dspy_all_approved,p.item_1_obstacle_passive,p.item_1_obstacle_negation,p.item_1_obstacle_complex_np,p.item_2_obstacle_passive,p.item_2_obstacle_negation,p.item_2_obstacle_complex_np,p.item_3_obstacle_passive,p.item_3_obstacle_negation,p.item_3_obstacle_complex_np,p.item_4_obstacle_passive,p.item_4_obstacle_negation,p.item_4_obstacle_complex_np,p.item_5_obstacle_passive,p.item_5_obstacle_negation,p.item_5_obstacle_complex_np,p.item_6_obstacle_passive,p.item_6_obstacle_negation,p.item_6_obstacle_complex_np,p.item_7_obstacle_passive,p.item_7_obstacle_negation,p.item_7_obstacle_complex_np,p.item_8_obstacle_passive,p.item_8_obstacle_negation,p.item_8_obstacle_complex_np
19-sys-13,stammaufgabe,multiple-choice,"Preisbildungsmodell Du hast schon gelernt, dass auf Märkten ein Zusammentreffen von Angebot und Nachfrage stattfindet. Um Güter gegen Geld zu tauschen, bildet sich dabei ein Preis, aber wie funktioniert das genau? Betrachten wir dafür ein Beispiel. Stell dir vor, du besitzt eine seltene Sammelkarte und möchtest diese verkaufen. Mechanismus Nr. 1 (Nachfrage): Je höher die Nachfrage, desto höher ist tendenziell der Preis. Umgekehrt gilt: Je geringer die Nachfrage, desto geringer ist tendenziell der Preis. Wenn sich nur eine Person für deine Sammelkarte interessiert, wirst du sie vermutlich nicht so teuer verkaufen können. Interessieren sich dagegen zehn Personen für sie (höhere Nachfrage), kannst du vermutlich einen höheren Preis erzielen. Die Interessenten konkurrieren dann um deine Sammelkarte – und überbieten sich hoffentlich gegenseitig. Mechanismus Nr. 2 (Angebot): Je höher das Angebot, desto geringer ist tendenziell der Preis. Umgekehrt gilt: Je geringer das Angebot, desto höher ist tendenziell der Preis. Stell dir vor, ein Mitschüler taucht auf und besitzt gleich mehrere Exemplare deiner Sammelkarte, die er ebenfalls verkaufen möchte (höheres Angebot). Die Interessenten können sich jetzt zwischen euch und euren Angeboten entscheiden – und du musst deine Preisvorstellung vielleicht nach unten korrigieren, damit du deine Karte trotz der Konkurrenz durch deinen Mitschüler loswirst. Mechanismus Nr. 3 (Preis): Je höher der Preis, desto geringer ist die Nachfrage und desto höher das Angebot. Je geringer der Preis, desto höher ist die Nachfrage und desto geringer das Angebot. Grundsätzlich gilt: Je höher der Preis deiner Sammelkarte ist, desto weniger deiner Mitschüler*innen werden diese kaufen wollen. Gleichzeitig ist der Preis auch für die Anbieter*innen wichtig: Je teurer man die Karte verkaufen kann, desto mehr Leute sind bereit, ihre Karten anzubieten. <image>","Was ist der Hauptgrund dafür, warum ein hoher Preis für eine Sammelkarte tendenziell zu einer geringeren Nachfrage führt? <option>Weil die Leute mehr Geld haben<option>Weil sie die Karte nicht so gerne haben<option>Weil das Angebot höher wird<option>Weil die Nachfrage nach dem Geld steigt<option>Zusätzliche Option 5<option>Zusätzliche Option 6","Was ist der Hauptgrund dafür, warum ein hoher Preis für eine Sammelkarte tendenziell zu einer geringeren Nachfrage führt?

A) Weil die Leute mehr Geld haben
B) Weil sie die Karte nicht so gerne haben
C) Weil das Angebot höher wird
D) Weil die Nachfrage nach dem Geld steigt","Welches von den folgenden Szenarien zeigt, wie ein hoher Preis zu einem höheren Angebot führen kann? <option>Wenn nur eine Person für die Sammelkarte interessiert ist und sie hochpreisen möchte<option>Wenn zehn Personen für die Karte interessiert sind, aber der Verkäufer dennoch einen hohen Preis verlangt<option>Wenn ein Mitschüler taucht auf und mehrere Exemplare der Sammelkarte besitzt, um sie zu überbieten<option>Wenn niemand für die Karte interessiert ist und sie deshalb keinen Preis haben kann<option>Zusätzliche Option 5<option>Zusätzliche Option 6","Welches von den folgenden Szenarien zeigt, wie ein hoher Preis zu einem höheren Angebot führen kann?

A) Wenn nur eine Person für die Sammelkarte interessiert ist und sie hochpreisen möchte
B) Wenn zehn Personen für die Karte interessiert sind, aber der Verkäufer dennoch einen hohen Preis verlangt
C) Wenn ein Mitschüler taucht auf und mehrere Exemplare der Sammelkarte besitzt, um sie zu überbieten
D) Wenn niemand für die Karte interessiert ist und sie deshalb keinen Preis haben kann","Wie beschreibt das Preisbildungsmodell die Beziehung zwischen Preis und Angebot? <option>Je höher der Preis, desto höher das Angebot<option>Je geringer der Preis, desto höher das Angebot<option>Je höher der Preis, desto geringer das Angebot<option>Je geringer der Preis, desto geringer das Angebot<option>Zusätzliche Option 5<option>Zusätzliche Option 6","Wie beschreibt das Preisbildungsmodell die Beziehung zwischen Preis und Angebot?

A) Je höher der Preis, desto höher das Angebot
B) Je geringer der Preis, desto höher das Angebot
C) Je höher der Preis, desto geringer das Angebot
D) Je geringer der Preis, desto geringer das Angebot",Explizit,0 (Kein Bezug),Stufe 1 (Wissen/Reproduktion),multiple-choice,stammaufgabe,"Weil die Leute mehr Geld haben, Weil sie die Karte nicht so gerne haben, Weil das Angebot höher wird, Weil die Nachfrage nach dem Geld steigt, Zusätzliche Option 5, Zusätzliche Option 6, Wenn nur eine Person für die Sammelkarte interessiert ist und sie hochpreisen möchte, Wenn zehn Personen für die Karte interessiert sind, aber der Verkäufer dennoch einen hohen Preis verlangt, Wenn ein Mitschüler taucht auf und mehrere Exemplare der Sammelkarte besitzt, um sie zu überbieten, Wenn niemand für die Karte interessiert ist und sie deshalb keinen Preis haben kann, Zusätzliche Option 5, Zusätzliche Option 6, Je höher der Preis, desto höher das Angebot, Je geringer der Preis, desto höher das Angebot, Je höher der Preis, desto geringer das Angebot, Je geringer der Preis, desto geringer das Angebot, Zusätzliche Option 5, Zusätzliche Option 6",True,"[False, False, True]","[True, True, True]","[3.0, 3.4, 3.2]",Nicht vorhanden,Nicht Enthalten,Nicht Enthalten,Enthalten,Enthalten,Nicht Enthalten,Nicht Enthalten,True,True,5,True,Enthalten,Nicht Enthalten,Enthalten,Nicht Enthalten,Enthalten,Enthalten,Enthalten,Enthalten,Enthalten,Nicht Enthalten,Nicht Enthalten,Nicht Enthalten,Enthalten,Nicht Enthalten,Nicht Enthalten,Nicht Enthalten,Enthalten,Nicht Enthalten,Enthalten,Enthalten,Nicht Enthalten,Nicht Enthalten,Nicht Enthalten,Enthalten
