c_id,subject,type,text,question_1,initial_question_1,question_2,initial_question_2,question_3,initial_question_3,p.instruction_explicitness_of_instruction,p.mathematical_requirement_level,p.taxanomy_level,question_type,p.variation,answers,typed_pipeline_used,refinement_applied,format_preserved,expert_average_ratings,p.root_text_reference_explanatory_text,p.root_text_obstacle_passive,p.root_text_obstacle_negation,p.root_text_obstacle_complex_np,p.root_text_contains_irrelevant_information,p.instruction_obstacle_passive,p.instruction_obstacle_complex_np,dspy_consensus_used,dspy_modular_prompts,dspy_expert_count,dspy_all_approved,p.item_1_obstacle_passive,p.item_1_obstacle_negation,p.item_1_obstacle_complex_np,p.item_2_obstacle_passive,p.item_2_obstacle_negation,p.item_2_obstacle_complex_np,p.item_3_obstacle_passive,p.item_3_obstacle_negation,p.item_3_obstacle_complex_np,p.item_4_obstacle_passive,p.item_4_obstacle_negation,p.item_4_obstacle_complex_np,p.item_5_obstacle_passive,p.item_5_obstacle_negation,p.item_5_obstacle_complex_np,p.item_6_obstacle_passive,p.item_6_obstacle_negation,p.item_6_obstacle_complex_np,p.item_7_obstacle_passive,p.item_7_obstacle_negation,p.item_7_obstacle_complex_np,p.item_8_obstacle_passive,p.item_8_obstacle_negation,p.item_8_obstacle_complex_np
20-sys-12,leicht,mapping,"Modelle Modelle helfen uns, die Wirklichkeit zu verstehen, aber bilden sie nicht vollständig ab. <image>Modelle vereinfachen die Wirklichkeit, damit wir sie besser verstehen. Eine Straßenkarte, wie man sie häufig auch in Navigationsapps sieht, ist z. B. eine vereinfachte Anschauungsversion des richtigen Straßennetzes. Sie ist ein Abbild der Straßen, Wege und Plätze. Die Stadt oder der Ort sieht in Wirklichkeit jedoch anders aus. !Aber Vorsicht! Modelle bilden die Wirklichkeit nie vollständig ab. Wer allein ein Modellauto betrachtet, könnte z. B. denken, Autos enthielten keinen Motor. Damit ein Modell funktioniert, muss man daher bestimmte Modellannahmen treffen. Ein Modellauto z.B. taugt nur dann als Anschauung eines richtigen Autos, wenn man sich bewusst ist, dass die Technik (Motor, Elektronik, etc.) im Modell vernachlässigt wird. Die Straßenkarte beschränkt sich also auf die für uns wesentlichen Informationen (Wo ist welche Straße? / Welcher Weg ist der schnellste?), ohne dass wir tatsächlich vor Ort sein müssen. Modelle lenken so den Fokus auf das Wesentliche der Sache, die sie abbilden. Modelle sind aber nicht immer auch konkrete Gegenstände wie das Modellauto, der Stadtplan oder ein Globus. Häufig werden sogenannte Denkmodelle genutzt, um besonders komplizierte Zusammenhänge besser zu verstehen. Ein Beispiel dafür ist das in der Wirtschaft häufig genutzte Preisbildungsmodell. ","Wie kann man Modelle verstehen, die die Wirklichkeit abbilden? <start-option>Bedürfnisse<start-option>Nachfrage<start-option>Angebot<start-option>Markt<end-option>Wünsche von Menschen<end-option>Was Kunden kaufen wollen<end-option>Was Unternehmen anbieten<end-option>Ort des Tauschens","Wie kann man Modelle verstehen, die die Wirklichkeit abbilden?
<start-option>Modelle sind vollständige Abbilder der Wirklichkeit</start-option>
<option>Modelle vereinfachen die Wirklichkeit, damit wir sie besser verstehen</option>
<option>Modelle bilden die Wirklichkeit nie vollständig ab</option>
<end-option>",Was ist ein Beispiel für eine Straßenkarte als Modell der Wirklichkeit? <start-option>Bedürfnisse<start-option>Nachfrage<start-option>Angebot<start-option>Markt<end-option>Wünsche von Menschen<end-option>Was Kunden kaufen wollen<end-option>Was Unternehmen anbieten<end-option>Ort des Tauschens,"Was ist ein Beispiel für eine Straßenkarte als Modell der Wirklichkeit?
Straßenkarten zeigen das tatsächliche Straßennetz
Straßenkarten vereinfachen die Wirklichkeit, damit wir sie besser verstehen
Eine Straßenkarte ist ein Abbild des richtigen Straßennetzes, aber nicht vollständig
<start-option>Betrachten Sie eine Straßenkarte als Modell der Wirklichkeit</start-option>
<option>Ein Straßenplan ist ein Beispiel für ein Modell der Wirklichkeit</option>
<end-option>","Was muss man wissen, um Modelle zu verstehen? <start-option>Bedürfnisse<start-option>Nachfrage<start-option>Angebot<start-option>Markt<end-option>Wünsche von Menschen<end-option>Was Kunden kaufen wollen<end-option>Was Unternehmen anbieten<end-option>Ort des Tauschens","Was muss man wissen, um Modelle zu verstehen?
Man muss sich daran erinnern, dass Modelle vollständige Abbilder sind
Modelle bilden die Wirklichkeit nie vollständig ab
Man muss sich bewusst sein, dass Modelle bestimmte Modellannahmen treffen müssen
<start-option>Modelle sind vollständige Abbilder der Wirklichkeit</start-option>
<option>Man muss sich daran erinnern, dass Modelle bestimmte Annahmen treffen müssen</option>
<end-option>",Implizit,2 (Mit Bezug),Stufe 2 (Anwendung/Transfer),mapping,leicht,"Bedürfnisse, Nachfrage, Angebot, Markt, Wünsche von Menschen, Was Kunden kaufen wollen, Was Unternehmen anbieten, Ort des Tauschens, Bedürfnisse, Nachfrage, Angebot, Markt, Wünsche von Menschen, Was Kunden kaufen wollen, Was Unternehmen anbieten, Ort des Tauschens, Bedürfnisse, Nachfrage, Angebot, Markt, Wünsche von Menschen, Was Kunden kaufen wollen, Was Unternehmen anbieten, Ort des Tauschens",True,"[False, True, True]","[True, True, True]","[3.6, 3.4, 3.2]",Implizit,Enthalten,Enthalten,Nicht Enthalten,Nicht Enthalten,Enthalten,Enthalten,True,True,5,True,Nicht Enthalten,Nicht Enthalten,Enthalten,Enthalten,Nicht Enthalten,Enthalten,Nicht Enthalten,Enthalten,Enthalten,Enthalten,Enthalten,Enthalten,Nicht Enthalten,Nicht Enthalten,Nicht Enthalten,Enthalten,Nicht Enthalten,Nicht Enthalten,Nicht Enthalten,Enthalten,Nicht Enthalten,Enthalten,Enthalten,Nicht Enthalten
